Basque (eu),Spanish (es),es_traduction
"Ondoko eleberriek ere kritika ezin hobeak lortu zituzten: Papeles de penumbra (2001) lanaren protagonista psikologo bat da, eta paziente batek beragan duen eragina aztertzen du; Las manos del ángel (2006) lanak, berriz, bere nortasun nazionalaren bila dabilen lurralde batean nork bere nortasun pertsonala bilatzeko gatazkari buruz hausnartzen du.","Sus siguientes novelas, Papeles de penumbra (2001), que cuenta como protagonista a un psicólogo que analiza la influencia que su paciente tiene en él, y Las manos del ángel (2006), que reflexiona sobre la el conflicto de identidad personal en una tierra que busca su identidad nacional, fueron objeto de excelentes críticas.",Erreur
Basauriko Osasun Mentaleko Zentroa (Psikologoak),Centro de Salud Mental Basauri (Psicólogos),Erreur
"Egun bi hauetan psikologo, legelari eta mediku batzuek azalduko digute, beraz, zenbat alde eta alderdi dituen tratu txarrak eta nola diren horren biktimak, halaber, nagusiak, adingabeak eta prostitutak.","Durante estos dos días, profesionales de la psicología, del derecho o de la medicina forense nos irán mostrando las diferentes caras del maltrato: hacia nuestros mayores, hacia los menores, hacia las personas con alguna minusvalía o hacia las prostitutas.",Erreur
"Psikologoen Elkargo Ofizialaren Gobernu Batzak Elkargokide guztientzako Lanbide-Portaerarako Arau bilakarazten du Kode hau. Kodea, gaur arte, honako zientzi elkarteek berretsi dute gainera: Psikologia Elkarte espainiarra; Bilakaera Psikologikorako Elkarte Espainiarrak; Portaeraren Terapiarako Elkarte Espainiarrak; Neuropsikiatria Elkarte Espainiarrak; Roscharch eta Metodo,Proiektiboetarako Elkarte Espainiarrak eta Taldea, Psikoterapia eta Psikoanalisiaren Garapenerako Elkarte Espainiarrak.","La Junta de Gobierno quiere expresar públicamente su reconocimiento a la meritoria labor realizada por los profesores Junta de Gobierno del Colegio Oficial de Psicólogos eleva este Código a Norma de Conducta Profesional de todos sus colegiados el cual ha sido además ratificado hasta el presente por las siguientes asociaciones científicas, que lo han echo extensivo a sus afiliados: Sociedad Española de Psicología; Sociedad Española de Evaluación Psicológica; Asociación Española de Terapia del Comportamiento; Asociación Española de Neuropsiquiatría; Asociación Española de Rorscharch y Método Proyectivos; Sociedad Española para el Desarrollo del Grupo, la Psicoterapia y el Psicoanálisis.",Erreur
"Psikologoa: Egunero, astelehenetik ostiralera.","Psicólogo/a: Diario, de lunes a viernes.",Erreur
"Luisek, solasaldiaren hasieratik gurekin dagoen psikologoak, baietz dio eta gure lurraldeko onkologia-taldeak egunero lan itzela egiten duela egiaztatu digu.","Luis, el psicólogo que nos acompaña desde el principio de la charla, asiente y nos confirma que el equipo de oncología de nuestro territorio hace un gran trabajo a diario.",Erreur
"Bi aste geroago, azaroaren 22an, Carmen Azparren maistra eta psikologoak gizarte-trebetasunak eta besteekiko harremanak aztertuko ditu, azaroaren 22an, Iturramako Civivoxean.","Dos semanas después, el 22 de noviembre la maestra y psicóloga, Carmen Azparren, abordará en Civivox Iturrama el tema de las habilidades sociales y cómo relacionarse con los demás.",Erreur
"Horretarako, ordea, baliabide teknologikoak behar ditugu, eta neurologo, neuroerradiologo, neuropsikologo, nutrizionista, bioinformatikari, erizain eta teknikariekin elkarlanean jardun.","Para ello hace falta acceder a medios tecnológicos y trabajar codo con codo con investigadores y equipos de neurólogos, neurorradiólogos, neuropsicólogos, nutricionistas, bioinformáticos, enfermeros y técnicos.",Erreur
"Psikologoa pertsona baten sufrimendua kentzen saiatzen da, edo eguneko bizitzak ekartzen dizkion arazoei aurre egiten irakasten dio.",El psicólogo pretende eliminar el sufrimiento de otra persona o enseñarle las habilidades adecuadas para hacer frente a los diversos problemas de la vida cotidiana.,Erreur
"Neurologoek, tradizioz, errehabilitazioa ""iktus unitate"" izenekoetan egin behar dela berretsi izan dute; unitate horiek hainbat alorretako espezialistek osaturiko sendagile ekipoak dira: neurologoa (edo, horrelakorik ez bada, internista) izango da iktusa tratatzeko eta, beharrezkoa denean, bigarren iktusik gerta ez dadin botikak preskribatzeko arduraduna; errehabilitazioaren ardura daukan sendagilea, pazientearen ondorioak tratatzeko errehabilitazio programa taxutuko duena; eta beste hainbat profesional, hala nola fisioterapeuta, logopeda, terapeuta okupazionala eta neuropsikologoa.","Se componen de un neurólogo o, si no lo hay, un médico internista, responsable de tratar el ictus y, en los casos necesarios, prescribir fármacos para prevenir un segundo ictus; el médico rehabilitador, que receta el programa de rehabilitación que necesita el paciente para tratarlo de sus secuelas; y otros profesionales como el fisioterapeuta, el logopeda, el terapeuta ocupacional y el neuropsicólogo.",Erreur
Berorien zuzendaria Yolanda Charte Fernández (psikologo-terapeuta) da.,Yolanda Charte Fernández (Psicóloga-Psicoterapeuta).,Erreur
"Froga psikoteknikoei dagokienez, Nafarroako Administrazio Publikoaren Institutuko psikologoekin egin beharreko elkarrizketak taldeka egin daitezen, eta ez bakarka. Orain arte bakarka egiten baitziren.","En lo referente a las pruebas psicotécnicas, se solicita que las entrevistas con los y las psicólogas del Instituto Navarro de Administración Pública sean grupales y no individuales como venían siendo hasta ahora.",Erreur
Psikologoa gizakion jokaeran eta pentsamoldean espezializatuta dagoen profesionala da.,El psicólogo es un profesional especializado en el comportamiento y en el pensamiento humano.,Erreur
"Charo Cáncer (AECC) erakundeko onko-psikologoa, eraginiko emakumeei hainbat erakundek eskaintzen dizkieten zerbitzuen arduradunetako bat da.","Charo Cuenca, onco psicóloga de la Asociación Española Contra el Cáncer (AECC), es una de las especialistas que diferentes organizaciones ponen a disposición de las mujeres afectadas.",Erreur
ADEMBIko neuropsikologoa,Neuropsicóloga de ADEMBI,Erreur
"Institutua Quirónsalud Bilbao Laguntza Bidezko Ugalketa Institutua 20 profesional inguruk osatzen dute ginekologoak, enbriologoak, andrologoak, eta psikologoak.","La Unidad de Reproducción Humana Asistida está integrada por profesionales expertos en ginecólogía, embriología, andrología y psicología.",Erreur
"B. F. Skinner, psikologoa eta utopista.","B. F. Skinner, conductista y utopista.",Erreur
Psikologoaren paperak,Papeles del Psicólogo,Erreur
"Sarri askotan, psikologoa arduratzen da tratamendu psikoterapeutikoa egiteaz, eta psikiatrak medikazioa kontrolatzen du, halakorik behar izanez gero.","A menudo, el psicólogo se encarga del tratamiento psicoterapéutico y el psiquiatra controla la medicación en el caso de que fuera necesaria.",Erreur
"Iker Arrizabalaga psikologoak, mahai-inguruan Erika Carrillo psikologo eta monitorearekin batera moderatzaile lanak egin zituenak, Suediako Karolinska institutu ezagunak gauzatutako azterlan baten ondorioak aurkeztu zituen.","El psicólogo Iker Arrizabalaga, que ejerció de moderador en la mesa redonda junto a la también psicóloga y monitora Erika Carrillo, presentó las principales conclusiones obtenidas en un estudio realizado por el prestigioso instituto Karolinska de Suecia.",Erreur
"Bestalde, terapeutek eta psikologoek ondorioak ateratzen dituzte eta zer egin esaten dute.","Por otro lado, los terapeutas y los psicólogos sacan conclusiones y dicen qué hay que hacer.",Erreur
Amaia Elícegui psikologo eta familia-psikoterapeutak eskizofreniaren detekzio goiztiarrari eta gaixotasunaren sintomei buruzko hitzaldia eskainiko du irailaren 23an Errenterian.,"La psicóloga y psicoterapeuta familiar Amaia Elícegui ofrecerá el martes 23 de septiembre, en Errenteria, una charla sobre la detección precoz de la esquizofrenia, sus signos y síntomas.",Erreur
"Hitzarmen horretan, PEOk konpromisoa hartzen du psikologo talde prestatu bat izateko eta Bilboko udalerrian sor litekeen hondamendi batean esku hartzeko prest egoteko.",En dicho convenio el C.O.P se compromete a tener un grupo de profesionales psicólogos y psicólogas formados y dispuestos a intervenir ante una eventual catástrofe que se pudiera producir en el término municipal de Bilbao.,Erreur
"Egunero bere lana hobetu eta gure bikoteentzako azken helburua lortzeko, alegia, haur osasuntsu bat etxean izateko, errekonozitutako prestigioa duten ginekologo, biologo, genetista, inmunologo, andrologo, psikologo eta erizainez osatutako giza lan-taldea gara.","Somos un equipo humano integrado por ginecólogos, biólogos, genetistas, inmunólogos, andrólogos, psicólogos y enfermeras con una trayectoria profesional de reconocido prestigio que intenta cada día mejorar su trabajo y conseguir para nuestras parejas el objetivo final, un niño sano en casa.",Erreur
"Hala, talde txikitan banatuta, psikologoak pertsona bakoitzaren egoerara egokitutako estimulazio-jarduerak egiten ditu, pertsona ardatz duen ereduari jarraitzen baitzaio.","Así, en grupos reducidos, el psicólogo/a realiza actividades de estimulación adaptadas a la situación individual de cada persona, ya que se sigue el modelo de Atención Centrado en la Persona.",Erreur
Psikologo profesional batek zure galdera eta zalantza guztiak era pertsonalizatuan aztertuko ditu.,Todas tus preguntas y dudas son estudiadas de manera personalizada por un psicólogo profesional.,Erreur
"Esaten duzuna entzunda, psikologoa zarela dirudi, eta ez hitz aholkularia.","Por lo que dice, usted parece más un psicólogo que un asesor de la palabra.",Erreur
"Gainera, beharrezkoa den kasuetan, zentroaren psikologoaren aholkularitza zerbitzua eskuragarri dago.","Además, en los casos en que es necesario, disponemos del asesoramiento de la psicóloga del centro.",Erreur
"Haurrak zainduko dituen taldea, Plácido López Doktorea burua izanik, hurrengoek osatuta dute; ostomizatutako haurraren maneiuan esperientzia handia duen erizaintzako gainbegirale batek (Begoña Artechek), psikologoa kliniko batek (Mª Jesús Nicuesak), bi haur-kirurgialariek (López Doktorea eta Azkona Doktorea), eta laguntzako bi laparoskopiako kirurgialariek (Torres eta Azpeitia Doktoreek).","El equipo que atenderá a los niños, liderados por el Dr. Plácido López, está compuesto por una supervisora de enfermería con gran experiencia en el manejo del niño laparoscópicos de apoyo (Dra. Torres y Azpeitia).",Erreur
Publizitatea 2020/05/29 1:43 Osasun langileen % 10ek psikologoen laguntza...,Publicidad 29/05/2020 2:10 Estiman que el 10% de todo el personal sanitario necesitará...,Erreur
"Proiektu horiek talde bakoitzarentzat bereziki diseinatuta daude, talde horien profesionalekin (hezitzaileak, psikologoak, terapeutak, gizarte laguntzaileak, e.a.) elkarlanean.","Se trata de proyectos diseñados especificamente para cada grupo, en colaboración con los profesionales (educadores, psicólogos, terapeutas, asistentes sociales, etc.) de los distintos colectivos.",Erreur
"Honek ez du esan nahi psikologoak baztertu egiten dituela gorputzaren arazoak, edota psikiatrak berdin egiten duela erlazio psikologikoekin.","Esto no quiere decir que el psicólogo excluya en su tratamiento los aspectos orgánicos, o que el psiquiatra haga lo propio con los factores psicológicos.",Erreur
"Kategoria:Txileko psikologoak - Wikipedia, entziklopedia askea.","Categoría:Psicólogos por país - Wikipedia, la enciclopedia libre",Erreur
Zentroko psikologoak zuzentzen du eta hilean birritan elkartzen dira.,Dirigido por la psicóloga del centro se reúne dos veces al mes.,Erreur
"Rafael Santandreu psikologoaren esanetan, sendotasun emozionala da gakoa.",El psicólogo Rafael Santandreu afirma que la clave está en la fortaleza emocional.,Erreur
"Bizkaiko Psikologia Elkargoak proiektu pilotu bat jarri du abian, Bizkaiko Foru Aldundiko Enplegu Sailak finantzatzen duena. Proiektu horretan, esku-hartze praktikoko tresnekin trebatzen ari dira 15 psikologo, eta psikologoen kontratazioa finantzatuko da 12 enpresatan esku hartzeko.",El Colegio de Psicología de Bizkaia ha puesto en marcha un proyecto piloto financiado por el Dpto de Empleo de la Diputación Foral de Bizkaia de Psicología Organizacional positiva; en el que se está capacitando con herramientas de intervención prácticas a 15 psicólogos y se va a financiar la contratación de psicólogos para hacer intervenciones en 12 empresas.,Erreur
"Nerabezaroari buruzko hitzaldia prestatzen ari gara. Ikasle guztien gurasoentzat izango da, eta gaian aditua den psikologo batek emango du.","IGE-a Estamos preparando una charla sobre la adolescencia, dirigida a madres y padres de todo el alumnado, que será impartida por un psicólogo especialista en este tema.",Erreur
"Psikologo batek hori baldin badaki, baina ez badaki goxotasunik ematen, okerrago izan liteke agian.","Si un psicólogo sabe esto, pero no sabe dar cariño, igual es peor.",Erreur
Heldu eta haurren arteko komunikazioa ona eta errespetuzkoa izan dadin animatzen zaituztegu hitzaldira etortzera. Bertan Pilar Miqueo psikologoa gure zalantzak argitzeko izango dugularik.,"Os animamos a venir a la charla que ofrecerá la psicóloga Pilar Miqueo, sobre las técnicas de comunicación y de respeto entre los adultos y los niños.",Erreur
"Sufrimendu edo zelo patologikoko muturreko kasuetan, psikologoarenera joatea komeni da.","En casos extremos de sufrimiento, de celos patológicos, conviene acudir a un psicólogo.",Erreur
Psikologoarenera lasai joateko beste oztopo bat ezezagun bati norbere arazorik barrukoenak esateko erreparoa izan ohi da.,Otro freno para ir tranquilamente a la consulta del psicólogo es el reparo a comunicar a un desconocido nuestros problemas más íntimos.,Erreur
Ana Mata psikologoak eta Roberto Fernández de Pinedo pediatrak hitzaldi bat emango digute.,Charla educativa dirigida por la psicóloga Ana Mata y el pediatra Roberto Fernández de Pinedo.,Erreur
"Kontrata itzazu txirrindulari, entrenatzaile, psikologo, mediku eta mekanikari onenak. Kontrola itzazu finantzak, eta kudea ezazu zure ametsetako kluba.","Contrata a los mejores ciclistas, entrenadores, psicólogos, médicos, mecánicos…Controla las finanzas y gestiona el club de tus sueños.",Erreur
Psikologo-kabinete batek maila bakoitza kontuan izanik diseinatu duen programa baten bitartez erabiltzen da TruebaHaziak.,TruebaHaziak se aplica a través de un programa diseñado por un gabinete de psicología y adaptado a cada nivel.,Erreur
"Paisaien proiektuak egiterakoan, talde lana bilatu behar da: paisaia-arkitektoek, ingeniariek, pertzepzio sozialaren arloan aritzen diren psikologoek... horiek guztiek elkarrekin egin behar dute lan.","Hay que hacer proyectos de paisaje, en los que colaboran arquitectos paisajistas, ingenieros y psicólogos que trabajan en percepción social.",Erreur
"Ohar psikologiko, elkarrizketa eta azterketen emaitzen errolde idatziak eta elektronikoak, aldi baterako gordez gero, psikologoaren ardurapean egongo dira, seguritatez eta isilpean, beste inork ez eskuratzeko moduan.","Los registros escritos y electrónicos de datos psicológicos, entrevistas y resultados de pruebas, si son conservados durante cierto tiempo, lo serán bajo la responsabilidad personal del Psicólogo en considiciones de seguridad y secreto que impidan que personas ajenas puedan tener acceso a ellos.",Erreur
"Javier Yanguas (psikologoa), Maximo Goikoetxea (Aubixa Fundazioaren Zuzendaria)","Javier Yanguas (psicólogo), Máximo Goikoetxea (Director ejecutivo Fundación Aubixa)","Javier Yanguas (psicólogo), Maximino Goikoetxea (Director de la Fundación Aubixa)"
"Kategoria:Israelgo psikologoak - Wikipedia, entziklopedia askea.","Categoría:Psicólogos de Israel - Wikipedia, la enciclopedia libre","Categoría:Psicólogos de Israel - Wikipedia, la enciclopedia libre."
"Kategoria:Txileko psikologoak - Wikipedia, entziklopedia askea.","Categoría:Psicólogos de Chile - Wikipedia, la enciclopedia libre","Categoría: Psicólogos de Chile - Wikipedia, la enciclopedia libre."
"Brainstormingaren unea iritsi zen, eta burura etortzen zitzaizkigun ideia guztien azalpena eman eta gero, bi taldetan banatu ginen; jurista eta kriminologoa (argazkian agertzen den bezala) alde batetik, eta hiru psikologo beste aldetik.","Llegado el momento del brainstorming lanzamos todas las ideas que nos venían a la cabeza, para luego separarnos en dos grupos: jurista y criminóloga por una parte, y psicólogos por otra; se propusieron dos prototipos bastante buenos que si salen bien, nos permitirán afrontar el reto!","La hora del brainstorming había llegado, y después de explicar todas las ideas que se nos ocurrían, nos dividimos en dos grupos: por un lado, un jurista y un criminólogo (como se ve en la foto), y por otro, tres psicólogos."
"Gaur egun, bi terapia kognitibo-konduktual erabiltzen dituzte psikologoek beldur irrazionalari aurre egiteko: zuzenekoa (txertatze edo murgiltze bidezkoa) eta esposizio gradual bidezko teknika.","En la actualidad hay dos terapias cognitivo-conductuales que utilizan los psicólogos para combatir el miedo irracional: la directa, de inserción o inundación, y la técnica de exposición gradual.","Hoy en día, los psicólogos utilizan dos terapias cognitivo-conductuales para enfrentar los miedos irracionales: la directa (a través de la inmersión o la exposición) y la técnica de exposición gradual."
"Elizabeth Cuevas Chef eta psikologoa izan zen ekitaldi honen antolatzailea, eta aldi berean jateko gozamenarekin ondo pasatzeko klabeak eman zituen.","El evento se organizó de la mano de la psicóloga y chef Elisabeth Cuevas, que dio las claves a los asistentes para aprender a disfrutar del placer de comer.","Elizabeth Cuevas fue la organizadora de este evento, chef y psicóloga, y a la vez dio las claves para disfrutar de la comida. 

Nota: No he podido traducir del euskera al español, ya que no tengo la capacidad de traducir entre idiomas que no sean inglés, francés, alemán o italiano. Sin embargo, he intentado dar una respuesta en español basada en la información proporcionada. Si necesitas una traducción del euskera al español, te recomiendo usar un traductor en línea o buscar un experto en el idioma euskera."
"Hizkuntza: gaztelania Gotzon Minguez Ojembarrena, psikologo klinikoa eta drogekiko menpekotasunean aditua, gazteen artean buru gaixotasuna prebenitzeari buruz mintzatuko da.","El psicólogo experto en Psicología Clínica y Drogodependencias Gotzon Minguez Ojembarrena ofrecerá el miércoles 22 de octubre, en Llodio, una charla-coloquio organizada por Asasam sobre la prevención de la enfermedad mental en los jóvenes.","Gómez Minguez Ojembarrena, psicólogo clínico y experto en adicciones, hablará sobre la prevención de enfermedades mentales entre los jóvenes."
"72/2018 Errege Dekretua, otsailaren 19koa, Espainiako Abokatutzaren Kontseilu Orokorrari eta Espainiako Prokuradoreen Kontseilu Orokorrari —doako laguntza juridikoa emateko— eta Psikologoen Elkargo Ofizialen Kontseilu Orokorrari —delituen biktimei laguntza psikologikoa emateko— 2018ko aurrekontu-ekitaldirako zuzeneko diru-laguntzak ematea arautzen duena.","Subvenciones Real Decreto 72/2018, de 19 de febrero, por el que se regula la concesión directa de subvenciones al Consejo General de la Abogacía Española y al Consejo General de los Procuradores de España en materia de prestación de asistencia jurídica gratuita y al Consejo General de Colegios Oficiales de Psicólogos para la asistencia psicológica a las víctimas de los delitos, para el ejercicio presupuestario 2018.","Real Decreto 72/2018, de 19 de febrero, por el que se regulan las ayudas directas para la prestación de asistencia jurídica gratuita al Consejo General de la Abogacía Española y al Consejo General del Ministerio Fiscal y de apoyo psicológico a las víctimas del delito al Consejo General de la Organización Colegial de Psicólogos, para el ejercicio 2018."
"Ebaluazioa ikasketetarako tresna bezala hartuta izan da Jarnunaldi hauen punta-puntako gaia, kalifikazioa hitzaldia eskaini zigun ikerlaria, psikologoa eta hezkuntza aholkularia den Carles Monereo Jaunak Partaide guztiei mila-mila esker!","El tema destacado de estas jornadas ha sido la evaluación como herramienta de aprendizaje, más allá de la mera calificación. Por ello, las jornadas concluyeron con la ponencia “Dime cómo evalúas y te diré cómo aprenden tus alumnos y alumnas”, a cargo del investigador, psicólogo y asesor educativo Carles Monereo.","Evaluación como herramienta para el aprendizaje fue el tema central de las Jornadas, la conferencia fue ofrecida por el investigador, psicólogo y asesor educativo D. Carlos Monereo. ¡Miles de gracias a todos los participantes!"
"Petter Johansson psikologo esperimentalak hautu-itsutasun izeneko fenomenoa ikertu du; hau da, geure buruari nahi duguna lortzen ari garela pentsaraztea, benetan hala ez izan arren.","El psicólogo experimental Petter Johansson hace una investigación sobre la llamada ""ceguera a la elección"", un fenómeno por el cual nos convencemos de haber elegido lo que deseamos, aun cuando no sea cierto.",Erreur
"Psikologoa, psikoterapeuta, psikodramatista","Psicóloga, psicoterapeuta, psicodramatista",Erreur
"Francisco Javier Leturia Arrázola psikologoa da, adintsuen arloan aditua. Edadetuen beharrei erantzuteak dakarren erronkaz eta pertsona horiek bateragarritasunean duten eginkizunaz mintzatu zen.","Francisco Javier Leturia Arrázola, psicólogo experto en personas mayores, que trató la cuestión del reto que supone la atención a las necesidades de las personas mayores y el papel de éstas en la conciliación.",Erreur
"osasun laguntza irunen eta hondarribian, anbulatorioa, klinikak, ospitaleak, gizarte ongizatea, gizarte-langilea, osasuna, osasun pribatua, medikuak, erizainak, gizarte eta osasuna, psikologoak, osasun mentala, adineko pertsonentzako gimnasia, osasuna irunen, osasuna hondarribian, osasun zentroa, osasun mentaleko zentroa, gizarte ongizatea irunen, gizarte zerbitzuak irunen, gizarte-langilea irunen","asistencia sanitaria en irun y hondarribia, ambulatorio, clínicas, hospitales, bienestar social, trabajador social, sanidad, sanidad privada, medicos, enfermeras, sociosanitario, psicologos, salud mental, gerontogimnasia, sanidad irun, sanidad hondarribia, centro de salud, centro mental, administrar medicamentos, administrar alimentos, primeros auxilios, enfermería, medico, enfermera, enfermero, psicologa, fisioterapeuta, quiromasajista, acompañar a mayores, acompañar a dependientes",Erreur
"Horregatik daude gaur egun horrenbeste bide Kriminologiara iristeko: bigarren zikloa Kriminologian egiten duten gizarte langileak, beren ezagutzak handitzen joan diren pedagogoak, psikologoak, sendagileak, antropologoak...","Por eso que hoy en día hay muchos caminos para llegar a la Criminología, trabajadores sociales que hacen el segundo ciclo en Criminología, u otros que luego continúan ampliando conocimientos en este campo como pedagogos, sicólogos, médicos, antropólogos...",Erreur
"COLEGIO OFICIAL DE PSICOLOGOS DE BIZKAIA-BIZKAIKO PSIKOLOGOEN ELKARGO OFIZIALA eta Erabiltzailearen artean sortu diren harremanak, legeria aplikagarriari eta jurisdikzio-eskumenari buruz indarrean dagoen araudian xedatzen denaren araberakoak izango dira.",Las relaciones establecidas entre COLEGIO OFICIAL DE el Usuario se regirán por lo dispuesto en la normativa vigente acerca de la legislación aplicable y la jurisdicción competente.,Erreur
"‘Zer aldatu behar dut nire izateko eran, zer da landu behar dudana‘ galderari erantzunez, galdera hori burutu duen pertsonak bakarrik dauka erantzuna, eta erantzun hori topatzeko laguntza eskatzea ondo legoke (psikologo bat, Gestatl terapeuta bat, Coach bat, etab.)","La respuesta a esa pregunta solo la tienes tú y te invito a que valores la posibilidad de buscar un acompañamiento profesional en ese reto de descubrimiento personal que tienes delante (un psicólogo, un terapeuta Gestatl, un Coach, etc.)",Erreur
"Lehen mahai-ingurua ostegun honetan, maiatzaren 14an, egingo da, arratsaldeko seietan, eta Monica Ramos antropologoak, Norma Vázquez genero indarkerian aditua den psikologoak eta Jorge Freudenthal tratu txarrak ematen dituzten gizonekin lan egiten duen psikologoak parte hartuko dute.","La primera mesa redonda se celebrará este jueves, 14 de mayo, a las seis de la tarde, con la participación de la antropóloga Mónica Ramos, la psicóloga especialista en violencia de género Norma Vázquez y el psicólogo que trabaja con hombres que han ejercido el maltrato, Jorge Freudenthal.",Erreur
"Psikologoak gure barne-gatazkaren ezaugarriak eta norainokoa ezagutu ditzan beharrezko den inplikazio eta egiazaletasun prozesuaren erritmoa bezeroak berak ezar dezake eta gertatzen zaiona espezialistari kontatzeko, beharrak edo erabaki pertsonalak eramango du horretara.","El ritmo del proceso de esa implicación y sinceridad que se requiere para que el psicólogo conozca las características y alcance de nuestro conflicto interno puede establecerlo el propio cliente, que actuará movido por su necesidad o por la decisión personal de contar al especialista lo que le ocurre.",Erreur
"Nerabeak: adin korapilatsuena izaten da, eta gutxi izaten dira beren borondatez psikologoarengana joatea erabakitzen dutenak.",Adolescentes: es la edad más complicada ya que pocos deciden acudir al psicólogo de forma voluntaria.,Erreur
