Basque (eu),Spanish (es),es_traduction
"Droga-menpekotasunaren prebentzioa eta esku-hartzea helburu duen ekimen honen baitan, atzokoan, San Juan de Dios ospitaleko Emilio Martin, psikologo klinikoa, eta Olaia Arrese, erizaina, izan ziren Gaztelupen, DBH 1 eta 2ko guraso eta irakasleekin.","Emilio Martín, psicólogo clínico, y Olaia Arrese, enfermera, fueron los encargados de dirigir las sesiones dirigidas a las familias y profesorado del alumnado de 1º y 2º de la ESO.",Erreur
Noiz eraman nire seme/alaba psikologoarengana?,¿Cuándo llevar a mi hijo al psicólogo?,Erreur
"Bet Firestein psikologoak bisexualak bere bikotea aukeratzean jasaten dituzten tentsio sozialak barneratzeko joera dutela baieztatzen du[47] eta homosexualak direla esatera behartuta sentitzen dira erdiko puntu batean egon beharrean. Izan ere, bi sexuekiko erakarpena izateak gizarteko monogamiaren balioari aurre egiten dio[47]. Gizarteak eragiten dituen presio horiek bisexualen osasun mentalean eraginak izan ditzakete.","El psicólogo Bet Firestein afirma que los bisexuales tienden a internalizar las tensiones sociales relacionadas con su elección de pareja[69] y se sienten presionados a etiquetarse como homosexuales en lugar de ocupar un punto medio difícil, donde la atracción a personas de ambos sexos desafía el valor de la monogamia en la sociedad.[69] Estas presiones sociales pueden afectar la salud mental de los bisexuales.",Erreur
"Arantza de Domingo. Psikologoa, haur eta nerabeetan espezializatua: ""Seme-alabek maitatuko gaituzte mugak jarriagatik ere""","Arantza de Domingo, Psicóloga especializada en niños y adolescentes: ""Nuestros hijos no dejan de querernos porque les pongamos límites""",Erreur
"Hezkuntza-psikologoaren zereginari dagokionez, proposamen horren helburua izango litzateke ikastetxeetan esku hartzeko mailak hobetzea eta haien kualifikazioa Hezkuntzaren Psikologia Masterraren bidez indartzea.",Con respeto al papel del psicólogo educativo esta propuesta consistiría en mejorar los niveles de intervención en los centros y reforzar su cualificación mediante el Máster de Psicología de la educación.,Erreur
"Programaren antolatzailea Bizkaia Talent da, eta hainbat entitaterekin koordinatuta garatuko da: Bilbao Metropoli-30, EHUko Zientzia eta Teknologia Fakultatea, Deustuko eta EHUko Zuzenbide Fakultateak, Deustuko Unibertsitateko Business School, EHUko Ingeniaritza Goi Eskola Teknikoa, Deustuko Ingeniaritza Goi Eskola (ESIDE), Mondragon Goi Eskola Politeknikoa, MUko Enpresagintza Fakultatea, EHUko Ekonomia eta Enpresa Fakultatea, eta bederatzi elkargo profesional: Ekonomialariak; Euskadiko Kimikariak eta Ingeniari Kimikoak; Bideetako Ingeniariak; Euskadiko Kanalak eta Portuak; Abokatuak; Euskal Herriko Industria Ingeniariak, Geologoak eta Psikologoak.","El programa está liderado por Bizkaia Talent y coordinado junto con Bilbao Metropoli-30, además de la Facultad de Ciencia y Tecnología de la UPV-EHU, la Facultad de Derecho de Deusto y de la UPV/EHU, Deusto Business School de la Químicos del País Vasco; Ingenieros de Caminos, Canales y Puertos del País Vasco; Abogados, Ingenieros Industriales, Geólogos y Psicólogos del País Vasco.",Erreur
"Diziplinartean eta elkarlanean lana egiteko beharraz konbentziturik gaudenez, ARTEAN (mediku psikiatrak, psikologoak, psikoterapeutak) osatzen dugu.","Un equipo de diferentes profesionales (médicos psiquiatras, psicólogos, psicoterapeutas) convencidos de la necesidad del trabajo multidisciplinar y de equipo.",Erreur
"Aldizka, gizarte-langileak, familiak eta psikologo-taldeak jarraipen-bilerak egingo dituzte aurrerapen-maila baloratu eta helburuak bete diren ikusteko.","Periódicamente, se realizan reuniones de seguimiento entre el/la trabajadora social y el equipo de psicólogos/as y con la familia para valorar el grado de avance y la consecución de los objetivos marcados.",Erreur
Vicenta Giménez Quirón Donostiako Laguntza Bidezko Ugalketa Unitateko psikologoa Psikologoa,Vicenta Giménez Psicóloga de la Unidad de Reproducción Asistida Quirón Donostia Psicóloga,Erreur
Bizkaiko Psikologoen Elkargo Ofizialeko Psikologia Klinikoko Batzordea lantalde dinamikoa da eta psikologia klinikoan diharduten edo gai horretan interesa duten elkargokideek osatzen dute.,La Comisión de Psicología Clínica del Colegio Oficial de Psicología de Bizkaia es un grupo de trabajo dinámico compuesto de colegiados-as que trabajan en psicología clínica o tienen interés en éste área.,Erreur
"Psikologoa Besteak Aholkularitza Fiskala, Lan aholkularitza eta Aholkularitza kontularia","Psicólogo Otros Asesoría Fiscal, Laboral y Contable",Erreur
"Egun, ikastetxe, enpresa, osasun zerbitzu publiko eta bestelako erakundeek ere psikologoak dituzte bertako ikasle, langile edo pazienteentzako.","En la actualidad, colegios, empresas, servicios públicos de salud y otras instituciones disponen de psicólogos para alumnos, trabajadores o pacientes.",Erreur
Laguntza Kategoria:Psikologoak herrialdearen arabera,Ayuda Categoría:Psicólogos de Israel,Erreur
"Asteartean, Martxoa 17, 19:30etan, ACABE GIPUZKOAren egoitzan, gurasoentzako hitzaldi bat antolatuko da: “Nola kudeatu gurasoen eta senideen segurtasun eza, ezintasuna, larritasuna, etab. beraien eta Elikadura Jokaera Nahasteak dituzten seme-alaben egoera hobetzeko?, Yolanda Iglesias ACABE GIPUZKOAko psikologoaren eskutik. barne-hitzaldiak","l Martes, 17 de marzo a las 19:30h, en la sede de ACABE GIPUZKOA, se ofrecerá para los padres y familiares, una charla-coloquio titulada: “¿Cómo gestionar la inseguridad impotencia, angustia, etc. de padres y familiares, para mejorar su situación y la de sus hijos/as afectados de Trastornos del Comportamiento Alimentario?” Será impartida por Yolanda Iglesias, psicóloga de ACABE GIPUZKOA",Erreur
"Hori dala eta, ikasturte honetan GURASO ESKOLA jarriko dogu martxan, iaz etorri jakun Bilboko Udaleko psikologoa dan Ana Saenzek eskutik, gure seme-alaben heziketarekin zerikusia daben gaiak sakontzen jarraituko dogu.","Por eso, este curso vamos a poner en marcha una ESCUELA DE MADRES Y PADRES, dirigida por la misma psicóloga del año pasado, Ana Sáenz, del Ayuntamiento de Bilbao, para seguir profundizando en todos aquellos temas relacionados con la educación de nuestros hijos e hijas.",Erreur
"Alvaro haurtzaroan hasi zen idazten, baina 20 urte inguru zituelarik alde batera utzi zuen zaletasun hori, psikologoak bere dohaina berreskuratzera animatu zuen arte.","Álvaro comenzó a escribir en su niñez, aunque abandonó esa afición hacia los 20 años hasta que su psicólogo le animó a rescatar su talento.",Erreur
"Psikoterapia indibidualera bideratu du, eta astean behin biltzen da taldeko psikologo batekin.",Le deriva a psicoterapia individual una vez por semana con una psicóloga del equipo.,Erreur
"Datorren asteazkenean, hilak 13an, 17:15ean, Nerea Mendizabal psikologoak hitzaldia eskainiko du zikloko familientzat.","El próximo miércoles, 13 de febrero a las 17:15, la psicóloga Nerea Mendizabal nos ofrecerá una charla a las familias del ciclo.",Erreur
"URTZI IBARGÜEN EUS Arte proiektu hau Peter Kruse psikologo alemaniarraren ikerketetatik abiatzen da, hiperkonektatutako generazio berrien inguruan errealitate hibrido baten oinarriak ezarririk, errealitate fisiko eta ziberespazioaren artean kokatzen den kultura berri baten estetika antropologiko/etnologiko bat definitzen duen arte-prozesu bat garatzeko.","Este proyecto artístico parte de los estudios del psicólogo alemán Peter Kruse, quien establece una nueva realidad híbrida de las nuevas generaciones hiperconectadas, para centrarse en el proceso definitorio de una estética antropológico/etnológica de esta nueva cultura, a medio camino entre la realidad física y el conocimiento científico y el conocimiento mítico, agregando que el mismo, al igual que la ciencia, son campos de conocimiento.",Erreur
"AAS irabazi asmorik gabeko erakundea da Suicidologia modernoaren “aita”, Edwin S. Shneidman psikologo klinikoak 1968. urtean sortua.","La AAS es una organización sin ánimo de lucro fundada por el «padre» de la Suicidología moderna, el psicólogo clínico Edwin S. Shneidman en 1968.",Erreur
"Psikologoa profesional espezializatua da, giza portaeraren arloko zientzialaria.","El psicólogo es un profesional especializado, un científico del comportamiento humano.",Erreur
"Bloga Harremanetarako Psikologoa, familia eta bikoteko psikoterapeuta","Blog Contacto Psicólogo, psicoterapeuta de familia y pareja",Erreur
"Horretarako, hainbat profesionalek osatutako taldea behar dugu: pediatrak, erizainak, psikologoak eta gizarte-langileak; etxera etor daitezen guri arreta egitera.","Para eso necesitamos que un equipo formado por profesionales médicos pediatras, enfermeros, psicólogos y trabajadores sociales, vengan a nuestra casa a atendernos.",Erreur
"Madrilgo Psikologoen Kolegio Ofiziala, Sevillako Unibertsitateko Psikologia Departamentua eta antzeko erakunde, organismo pribatu eta plataformek ikerlan zabala burutu dute, funtsezko galderari erantzutea xede harturik: Nolakoa da guraso lesbiana edo gayekin bizi diren neska-mutilen garapena eta doitze psikologikoa?","Desde organismos privados, plataformas e instituciones como el Colegio Oficial de Psicólogos de Madrid y el departamento de Psicología de la Universidad de Sevilla se ha llevado a cabo un estudio que ha tratado de responder a la pregunta clave: ¿Cómo es el desarrollo y ajuste psicológico de los chicos y chicas que viven con madres lesbianas o padres gays?",Erreur
"Psikologoak egin behar duzuna esango dizu, zeure buruari galderak egiten lagun zaitzake eta bidean lagunduko zaitu, galdera horien erantzunak aurkitu bitartean.","Un psicólogo no te dice lo que tienes que hacer, puede ayudar a hacerte preguntas y a acompañarte en el camino mientras las resuelves.",Erreur
Azterketa Zentroetako psikologoei indarrean jartzen diren legezko xedapenen berri ematea eta sektore honetan zer eragin izango duten adieraztea.,"los Centros de Reconocimiento, de las nuevas disposiciones legales que van apareciendo y que afectan a este sector. Imprimir",Erreur
Espainiako psikologo eta pedagogo ospetsuenetako batek berrikusi du materiala: María Jesús Álavak.,Su elaboración ha sido supervisada por una de las psicólogas y pedagogas más prestigiosas de nuestro país: María Jesús Álava.,Erreur
"Ekainaren 24an, astelehena, 17:00etan, Deustuko Unibertsitateak Osasun arreta humanizatzeari eta gizarte eta osasun esparruetan laguntza espirituala emateari buruzko aditua aurkeztuko du Santurtziko San Juan de Dios Ospitalean. Ekitaldi horretan, gaixo adituek, sendagileek, teologoek eta psikologoek hartuko dute parte.","El lunes 24 de junio a las 17 hs la Universidad de Deusto presentará el posgrado experto “Humanización de la salud y acompañamiento espiritual en los ámbitos social y sanitario” en el hospital San Juan de Dios de Santurtzi, acto en el que participarán pacientes expertos, médicos, teólogos y psicólogos.",Erreur
Aurkezpena bideo bitartez Robert J. Sternberg 1949. urtean jaio zen psikologo kognitibo estatubatuarra da.,Presentación por Video Robert J. Sternberg es un psicólogo cognitivo estadounidense nacido el 1949.,Erreur
"Genero eta Informazio Gizartean aditua den psikologo argentinar honek ikerkuntza ugari egin du genero, zientzia, teknologia eta…","Esta psicóloga argentina, experta en Género y Sociedad, que ha desarrollado numerosas investigaciones en temas de género…",Erreur
"Hori horrela, programaren dimentsio guztien ikuspegi osoa emango duten pertsonek osatuko dute talde sustatzailea: Ikastetxeetako ordezkariak, Baikara gurasoen ordezkari gisa, Kirol Egokituko Federazioa, Osakidetzako haur eta gazteen psikologo bat, Euskal Herriko Unibertsitatea, Arartekoaren bulegoko Elena Yarza, kirol teknikariak eta Real Sociedad Fundazioko Andoni Iraola, besteak beste.","Así el grupo promotor lo compondrán personas que aportan una visión completa de todas las dimensiones del programa: representante de centros escolares, Baikara en representación de padres y madres, Alicia Figueroa, Federación de Deporte Adaptado, Maite Fuentes y Luis Mari Zulaika de la Universidad del País Vasco, Elena Yarza de la oficina del Ararteko, técnicos deportivos, Andoni Iraola, de la Fundación Real Sociedad y Jon Kepa Eguren como Centro Educativo.",Erreur
"Saiatzeko aukera izatea gustatuko balitzaizueke, eta gugatik bozkatu, datorren Ekainaren 19an izango dira hauteskundeak Nafarroako Psikologoen Elkargoan, hemen ez daudenak korreoz bozka dezakete ere.","Si os gustaría que tuvieramos la oportunidad de intentarlo, y quisierais votar por nosotr@s,el próximo 19 de Junio serán las elecciones en el Colegio de Psicólogos de Navarra, quienes no puedan estar podrán votar por correo.",Erreur
"Elkarrizketa: Maite Garaigordobil, psikologoa eta jolasaren ikertzailea (123 Kb)","Entrevista a Maite Garaigordobil, psicóloga e investigadora del juego (122 Kb)",Erreur
"ADEMBIko neuropsikologoa Duela hamarkada batzuk jakin zen narriadura kognitiboa esklerosi anizkoitza eragin dezakeen sintometako bat dela Narriadura kognitiboa duen jendearen %60ak hainbat aldaketa nabaritzen ditu, bizitasun anitzekoak eta […]",Neuropsicóloga de ADEMBI Hace ya décadas que se conoce el hecho de que el deterioro cognitivo es uno de los síntomas que puede provocar la Esclerosis Múltiple. Alrededor del 60% de […],Erreur
"New York Alemania, 1885eko irailaren 16a - New York, Estatu Batuak, 1952ko abenduaren 4a) alemaniar psikologo eta psikoanalista izan zen.","Universidad Blankenese, Alemania, 16 de septiembre de 1885 - Nueva York, Estados Unidos, 4 de diciembre de 1952) fue una psicóloga y psicoanalista alemana naturalizada estadounidense.",Erreur
"Solasaldia: Justizia eta Géneroa -Maite Blanco (#violetademabulante proiektua eta berdintasun teknikaria), Pablo López Goenaga (Abokatua, Genero Indarkeriko komisioa ICAGI, Gipuzkoako Abokatuen Elkargo Prestua), Mariangeles Álvarez García (Psikologa, Berdintasuneko Komisioa COPGI, Gipuzkoako Psikologoen Elkargo Ofiziala).","-Maite Blanco (proyecto #violetademabulante y técnica de igualdad), Pablo López Goenaga (Abogado,Comisión de violencia de género, ICAGI, Ilustre Colegio de Abogados/as de Gipuzkoa), Mariangeles Álvarez García (Psicóloga, Comisión de Igualdad del COPGI, Colegio Oficial de Invitados/as Fila 0: Mamen Guimerans (Asociación Hegaldi).",Erreur
"Gaur egun, 7 urtetik 18 urtera bitarteko 43 umek lehen mailako arreta, laguntza psikosoziala, hezkuntza-errefortzua eta balioetako heziketa jasotzen dituzte, medikuen, psikologoen eta hezitzaileen eskutik.","En la actualidad, cuarenta y tres niños y niñas entre los 7 y los 18 años reciben atención primaria, psicosocial, refuerzo educativo y educación en valores por parte de profesionales médicos, psicólogos y educadores.",Erreur
"Oharra: Atal honek istorio osoa edo amaiera argitzen du. Peter Venkman (Bill Murray), Ray Stantz (Dan Aykroyd) eta Egon Spengler (Harold Ramis) hirukotearen ikerketa eta jokamolde xelebreen ondorioz New York hiriko Columbiako Unibertsitatetik kaleratutako hiru parapsikologo dira.","Peter Venkman (Bill Murray), Ray Stantz (Dan Aykroyd) y Egon Spengler (Harold Ramis) son tres parapsicólogos expulsados de la Columbia University en Nueva York, debido a sus estudios y prácticas poco ortodoxos, y que comienzan su propio negocio trabajando como cazafantasmas, e investigando fenómenos paranormales usando tecnología sofisticada para intentar capturar las manifestaciones ectoplasmáticas.",Erreur
"Bloga Harremanetarako Psikologoa, psikodramatista","Blog Contacto Psicóloga, psicodramatista",Erreur
"Medikuntzako ikasle, mediku eta psikologo talde batek sortu zuen GPAB 1975ean. Prestakuntza psikodinamikoa zuen psikiatra-psikoterapeuta talde bat Suitzatik bueltatu …","El GPAB tiene sus orígenes en un grupo de estudiantes de medicina, médicos y psicólogos que en el año 1.975, comienzan a reunirse en torno a la vuelta desde Suiza de …",Erreur
"Urte asko gurekin lanean daraman psikologo baten laguntza ere badugu. Bakarko edo taldekako jarduerak dauzkazu hemen, zure beharren arabera.","Contamos con un psicólogo que lleva años con nosotros y sabe cómo ayudarnos.Tenemos actividades individuales y en grupo,según necesites.",Erreur
"Dantzariak, koreografoak, psikologoak, clownak, aktoreak, marrazkilariak, irakasleak, zinemagileak, antzerki sortzaileak… denetariko profesionalen lanak jaso ditugu eta disziplina ezberdinetan jarduten badute ere, guztiak batzen ditu arteak, esperimentatu eta sortzeko gogoak.","Bailarinas, coreógrafas, psicólogos, clowns, actores, pintores, profesoras, cineastas… hemos recibido ideas de todo tipo de profesionales que a pesar de que trabajan en distintas disciplinas a tod@s les une el arte, las ganas de experimentar y crear.",Erreur
Psikologoek ikusi zuten hainbat pertsonak intimitate hori bilatzen zutela beren arazoak kontatzeko...,Los psicólogos se encontraron con no pocos casos de personas que se encerraban en la intimidad para contarle sus problemas...,Erreur
"Psikologoa erreminta bat da, pertsonaren barnean funtzionatzen ez duen eta behargabeko sufrimendua sortzen duena konpondu ahal izateko.",El psicólogo es una herramienta para poder arreglar lo que no funciona en el interior de la persona y que genera sufrimiento innecesario.,Erreur
"III. topaketa honetan Elena Yanguas psikologoak parte hartuko du, aurrerantzean saio horiek zuzentzeaz arduratuko dena.","En este III encuentro se incorpora la psicóloga Elena Yanguas, quién a partir de ahora será la encargada de dirigir estas sesiones.",Erreur
"Kategoria:Euskal Herriko psikologoak - Wikipedia, entziklopedia askea.","Categoría:Psicólogas - Wikipedia, la enciclopedia libre Ayuda",Erreur
"Itziar Cantera, Ianire Estébanez eta Ane Navarro, psikologoak eta talde hezitzailea.","Itziar Cantera, Ianire Estébanez y Ane Navarro, psicólogas y educadora de grupos.",Erreur
Madrilgo La Pazeko Ospitale Unibertsitarioan psikologo bezala aritu da. Baita Erizaindegi Eskola Unibertsitarioko Irakasle bezala ere.,Ha ejercido de psicólogo en el Hospital Universitario La Paz de Madrid y de Profesor en la Escuela Universitaria de Enfermería.,Erreur
"Beren arazoei buruz Batzuetan, bere bizitzako esperientziarekin eta munduarekin duen ikuspegia ezezagun batek psikologo onena bihurtzen du.","A veces, un extraño con su propia experiencia de vida y visión del mundo se convierte en el mejor psicólogo.",Erreur
"Psikologoa, lagun diezagukeen espezialista (68 Kb)","El psicólogo, un especialista que puede ayudarnos (68 Kb)",Erreur
Juan Carlos Alonso psikologoak ipuinen balioa agresibitate gaia jorratzeko aztertuko du.,El psicólogo Juan Carlos Alonso analizará el valor de los cuentos para tratar el tema de la agresividad.,Erreur
"Egun, nahasmendu bipolarra duten pertsonentzako talde terapia batean parte hartzen du astero, Agifeseko psikologo baten gidaritzapean, eta Donostia Ospitalean lan egiten du.","La vida en pareja, conducido por un psicólogo de Agifes y trabaja en el Hospital Donostia.",Erreur
"osasun laguntza irunen eta hondarribian, anbulatorioa, klinikak, ospitaleak, gizarte ongizatea, gizarte-langilea, osasuna, osasun pribatua, medikuak, erizainak, gizarte eta osasuna, psikologoak, osasun mentala, adineko pertsonentzako gimnasia, osasuna irunen, osasuna hondarribian, osasun zentroa, osasun mentaleko zentroa, gizarte ongizatea irunen, gizarte zerbitzuak irunen, gizarte-langilea irunen","asistencia sanitaria en irun y hondarribia, ambulatorio, clínicas, hospitales, bienestar social, trabajador social, sanidad, sanidad privada, medicos, enfermeras, sociosanitario, psicologos, salud mental, gerontogimnasia, sanidad irun, sanidad hondarribia, centro de salud, centro mental, bienestar social irun, auxilios, enfermería, medico, enfermera, enfermero, psicologa, fisioterapeuta, quiromasajista, acompañar a mayores, acompañar a dependientes",Erreur
"Ildo horretatik hainbat aukera zabaltzen dira zure etorkizun profesionalerako: adin gutxiko arau hausleei arreta ematea, cyber bullying-a bezalako delitu bide berrien aurrean; bizi kalitatea hobetzeko zerbitzuak, kultur zerbitzuak eta aisialdi zerbitzuak; ingurumenarekin zerikusia duten zerbitzuak, hala nola energia baliabideen kudeaketa edo natur guneen babesa; kirolaren psikologia, aurrera gelditu barik doan arloa, eta futbol taldeek hainbeste eskatzen dutena; eta, finean, hirugarren sektoreko lan ildo berriak, non psikologoek ekarpen garrantzitsuak egiten dituzten nazioarteko lankidetza programen diseinuan.","En este sentido, la atención a menores infractores ante las nuevas oportunidades delictivas como el ciber-bullying; el desarrollo de servicios de mejora de la calidad de vida, culturales y de ocio; servicios relacionados con el medio ambiente, como la gestión de recursos energéticos o la protección de espacios naturales; el imparable avance de la Psicología del Deporte, tan solicitada ahora por los clubes de futbol y, en fin, los espacios laborales abiertos en el denominado tercer sector donde los psicólogos realizan importantes contribuciones en el diseño de programas de cooperación internacional, son algunas de las opciones donde puedes encontrar tu futuro profesional.",Erreur
"Gipuzkoako Psikologoen Elkargo Ofizialak hitzarmen bat sinatu zuen 1993an Gipuzkoako Foru Aldundiarekin, bizikidetasunaren esparruan tratu txarrak jasaten dituztenei eta/edo sexu-askatasunaren aurkako delituen biktimei laguntza psikologikoa emateko.",El Colegio Oficial de Psicología de Gipuzkoa tiene conveniado con la Excelentísima Diputación Foral de Gipuzkoa un Programa de Atención Psicológica a víctimas del Maltrato en el Ámbito Convivencial y/o posibles delitos contra la libertad sexual desde 1993.,Erreur
"Zuzenduko duena: Yolanda Iglesias, ACABE GIPUZKOAko psikologoa","Será impartida por Yolanda Iglesias, psicóloga de ACABE GIPUZKOA",Erreur
"Martxoaren 17a - Franz Brentano, alemaniar filosofo eta psikologoa (j. 1838).","17 de marzo: Marjan Raciborski, pirata británico. (n. 1689).",Erreur
"Egoeraren arabera, baina psikologoari galdetu diezaiokegu bizitzako aspektu konkretu edo arazo puntual bati buruz.","Depende, existe la posibilidad de consultar al/a psicólogo/a por un aspecto concreto de tu vida o por un problema puntual.",Erreur
"Sendagilearen alta jaso denetik hainbat astebetera hobekuntzarik nozitu ez badu, ohiko sendagilearengana jotzea edo ebakuntzaz arduratu den taldearekin egoera jorratzea komeni izaten da, batak edo besteek pazientea psikologoarengana bidal dezaten.","Si no se mejora tras varias semanas de recibir el alta médica, es aconsejable acudir al médico de cabecera o comentar la situación con el equipo que se ha ocupado de la operación para que derive al paciente a un psicólogo.",Erreur
Laguntza programa hori adopzio arloko psikologo espezializatuek ematen dute.,Este programa de apoyo lo prestan terapeutas especializados en materia de adopción.,Erreur
"Laguntza bila psikologo batengana jotzen duenak sintomak deskribatu ohi dizkio (depresioa, antsietatea, larritasuna, beldurra...), eta normalena bere arazoen kausak eta horietarako konponbideak zein diren ez jakitea da.","Quien acude a un psicólogo en busca de ayuda le describe sus síntomas (depresión, ansiedad, angustia, miedo...), y lo habitual es que desconozca tanto las causas de sus problemas como la manera de resolverlos.",Erreur
Psikologoa. Executive MBA titulua eta erakundeen garapenari buruzko... »,"Tiene un Executive MBA, un máster en desarrollo... »",Erreur
"1974an, Herbert Freudemberg psikologoa lanean ari zen menpekotasunetarako klinika batean; han zegoela, konturatu zen berarekin zeuden boluntario gehienak, lankidetzako urte baten ostean, nekatuta, motibaziorik gabe, gaixoekiko oldarkor eta “erreta” zeudela.","En 1974 el psicólogo Herbert Freudemberg observó en la clínica para adicciones donde trabajaba como, tras un año de colaboración, la mayoría del voluntariado que le apoyaba, sufría agotamiento, desmotivación, agresividad hacia pacientes, y manifestaban encontrarse “quemados”. Bautizó este procesó con el nombre de “burnout”",Erreur
"Horixe da iradoki ninduen, alegia, pertsonaiek analisi psikologorik ez izateak eta hortxe geldorik egoteak, zuhaitzen antzera, eguraldiaren gorabeherak jasaten.","‘Me estimuló mucho la fantasía, el hecho de que los personajes no tienen un análisis psicológico, sino que están allí plantados, como los árboles siguiendo los avatares del mal o buen tiempo. pero eso sí, ¡tan vivos!",Erreur
"Gure ikasleen hezkuntza-prozeduran eragina duten zentrotik kanpoko agenteekiko koordinazioa: Psikologoak, Udaletxeko programak, Berritzegune,…","Que inciden como especialistas en el proceso educativo de nuestros alumnos: Psicólogos, Programas del Ayuntamiento, Berritzegune... Ambito familiar",Erreur
Profesionalen taldea bi irakaslek osatzen dute eta psikologo baten laguntza ere badute.,El equipo de profesionales lo componen dos profesoras que cuentan con el apoyo de una psicóloga.,Erreur
Ondoren Psikologia eta Aurkezpena bideo bitartez Robert J. Sternberg 1949. urtean jaio zen psikologo kognitibo estatubatuarra da.,Robert Sternberg Presentación por Video Robert J. Sternberg es un psicólogo cognitivo estadounidense nacido el 1949.,Erreur
Psikologoen elkargo ofiziala (COP),Colegio Oficial de Psicólogos (COP),Erreur
