Basque (eu),Spanish (es),es_traduction
"Psikologo lanbidearen eginbehar eta eskubideak profesional mailako independentzi eta askatasunezko erizpide batetan oinarriturik antolatzen dira, erakunde jakinean bete dezakeen agintemaila edozein izan litekelarik beste profesional eta goiko-agintari batzuekiko.","Los deberes y derechos de la profesión de Psicólogo se constituyen a partir de un principio de independencia y autonomía profesional, cualquiera que sea la posición jerárquica que en una determinada organización ocupe respecto a otros profesionales y autoridades superiores.",Erreur
"Proiekzioaren ondoren, psikologo batek gidatutako solasaldian parte hartzeko aukera izango du ikusleak, filmaren mezuan sakondu eta zalantzak argitu ahal izateko.","Una vez finalizada la proyección, el espectador podrá disfrutar del coloquio conducido por una psicóloga para analizar el mensaje del filme y aclarar las posibles dudas.",Erreur
"Elkartearen helburuak dira laguntza neurologiko zentralizatua lortzea, talde bakarrean biltzea mediku laguntzako zerbitzuak –fisioterapeutak, logopedak eta psikologoak– eta laguntza prestazioak hobetzea; autolaguntzako taldeak sustatzea, beharra duten pertsona guztiengana gure inguru hurbilenean iristea eta, azken finean, beren bizi kalitatea hobetzea, laguntza morala ere emanez.","Los objetivos de esta asociación son lograr una asistencia neurológica centralizada, aunar en un equipo los servicios de ayuda médica, como fisioterapeutas, logopedas y psicólogos, y mejorar las prestaciones asistenciales. El impulso de los grupos de autoayuda, llegar a todas las personas que lo necesiten en nuestro entorno más cercano y en definitiva, mejorar su calidad de vida, aportando también apoyo moral.",Erreur
"Rafael Santandreu, Psikologoa eta 'El arte de no amargarse la vida' liburuaren egilea: ""Langabeziak deprimi gaitzan uzten badugu, bi arazo izango ditugu, eta bigarrena askoz okerragoa izan daiteke"" Tweet","Rafael Santandreu, Psicólogo y autor de 'El arte de no amargarse la vida': ""Si nos dejamos deprimir por el paro tendremos dos problemas y el segundo puede ser mucho peor"" Tweet",Erreur
"Ikastetxeetan, psikologo-taldeak ohituta daude haien garapen emozionala eta ikaskuntza-arazoak antzematen, lehenbailehen eta ahalik modu eraginkorrenean gainditu ditzaten.","En los colegios, los equipos de psicólogos están estrenados en evaluar su desarrollo emocional y detectar problemas de aprendizaje con el propósito de que sean superados cuanto antes y de la forma más eficaz.",Erreur
"Gonzalez, psikologoa: “Atleta ona izatea ez da soilik sasoi fisikoaren araberakoa, alderdi psikologikoak ere funtsezkoak baitira probetan arrakasta edukitzeko” Policlínica Gipuzkoa","Susana González, psicóloga: “Ser un gran atleta no es solo una cuestión física, los aspectos psicológicos juegan un papel fundamental en el éxito final de las pruebas” Policlínica Gipuzkoa",Erreur
"Boluntario adituak nahi ditugu, efikazia eraginkorra kudeatuko dutenak; ez ditugu zaintzaileak soilik nahi, baizik eta medikuak, erizainak, gizarte-langileak, arkitektoak, psikologoak, abokatuak, ekonomialariak, idazleak eta komunikatzaileak…","Queremos voluntarios expertos que gestionen una eficacia eficiente; no solo queremos a la cuidadora y al cuidador, sino también a médicos, enfermeros, sea una realidad gracias a múltiples y variadas iniciativas.",Erreur
"Dakizunez, Udalak OSASUNERAKO HEZKUNTZAren kurtso eta tailer guztiak bertan behera utzi ditu, ondorioz eta zoritxarrez, hau da dugun azken aukera eskarmentu handiko eta komunikatzaile trebea den psikologo honi entzun ahal izateko.","Como sabrás el Ayuntamiento ha suprimido todos los cursos y talleres del programa de EDUCACIÓN PARA LA SALUD, por lo que será, por desgracia, la última oportunidad que tendremos de poder escuchar a una psicóloga con una amplia experiencia en este campo, y una excelente comunicadora.",Erreur
"Bizkaiko Psikologoen Elkargo Ofiziala Estatutu hauen bidez arautuko da, lanbidearen jarduera arautzen duten legeei kalterik egin gabe, eta baita onartu daitezkeen barne-araubideko araudien bidez ere; araudi horiek ezingo dira estatutu hauetan xedaturikoaren aurkakoak izan. COP Bizkaiko Estatutuak","El Colegio Oficial de Psicólogos de Bizkaia se regirá por estos Estatutos, sin perjuicio de las leyes que regulen el ejercicio de la profesión, así como por los Reglamentos de Régimen Interior que se pudieran aprobar, los cuales no podrán ir contra lo dispuesto en el 23 de Marzo de 2012.",Erreur
Copyright © 2014 Bizkaiko Psikologoen Elkargo Ofiziala,Federación Europea de Asociaciones Profesionales de Psicólogos EFPA,Erreur
"Hezkuntzari loturik daudenetan Zuzendaritza Taldeentzako, Langile Teknikoentzako (Irakasleak, Psikologoak, Pedagogoak, Gizarte Langileak, Hezitzaile Sozialak...direnentzako) eta Ikastetxeetako Zerbitzu Laguntzaileetan lan egiten duten langileentzako.","Educativos para Equipos de Dirección, para personal técnico (Profesores, Psicólogos, Pedagogos, Trabajadores Sociales, Educadores Sociales, etc..) y personal de Servicios Auxiliares de los Colegios o Centros Educativos.",Erreur
"Psikologoek zehaztu dute informazio fluxua arautzea komeni dela, ""eta behar dena baino gehiago ez ematea"".","Los psicólogos precisan que es conveniente regular el flujo de información, ""y no proporcionarles más de la necesaria"".",Erreur
"Erakunde-psikologoaren zeregina batzuetan, erakundeko pertsonek bizi dituzten egoerak behatzea, entzutea eta baloratzea da, ondoren esku hartzeko.","El papel del psicólogo organizacional pasa, en ocasiones por observar, escuchar y valorar las diferentes situaciones que viven las personas de la organización para pasar a una intervención posterior.",Erreur
- Barruko psikologo egoiliarren praktiketako tutorea (BAPE).,- Tutor en Prácticas de Psicólogos Internos Residentes (PIR).,Erreur
"Beno, ezin dugu ahaztu psikologoak autoaren haizetako-garbigailuen modukoak garela; jendeari bidea hobeto ikusten laguntzen diogu, baina bakoitzak bere bidea hartu behar du.","El psicólogo no dirige la vida de nadie, nosotros somos como los limpiaparabrisas del coche, ayudamos al conductor para ver mejor el camino, pero cada cual debe seguir su ruta.",Erreur
"Bere bermeek tratamenduak eta terapia osagarriak eta alternatiboak barneratzen dituzte espezializatutako zentroetan, balneoterapia, termalismoa, miopiaren kirurgia, logopedia, ortopediaren kirurgia, laguntza ugalketa eta emankortasun tratamendua, tabakoa uztea, urtero psikologora doako 2 kontsulta, alegia.","Sus garantías incluyen tratamientos y terapias complementarias y alternativas en centros especializados, tales como balneoterapia, termalismo, cirugía de la miopía, logopedia, ortopedia, reproducción asistida y tratamiento de fertilidad, tratamientos de deshabituación tabáquica, 2 consultas anuales gratuitas al psicólogo, entre otras.",Erreur
"Kasu askotan, ikastetxeetako hizkuntza politika dela eta, edo haurrek euskaraz hobeto ulertzen dutelako, psikologo askok ebaluazio psikologikorako ad-hoc itzulpenak egiten dituzte gaztelaniatik, haurrek hobeto uler dezaten, baina erabilitako testek gaztelaniaz bereizgarri psikometriko egokiak badituzte ere, ez da berdin gertatzen euskarazko itzulpenarekin (Isasi, Balluerka eta Gorostiaga, 2000).","En muchos casos, debido a la política lingüística del centro, o a que los estudiantes se expresan mejor en euskara, muchos psicólogos realizan traducciones ad hoc del castellano al euskara de los instrumentos necesarios para la evaluación psicológica, con el fin de que los niños logren una mejor comprensión. Sin embargo, a pesar de que las características psicométricas de los tests empleados son apropiadas en castellano, no sucede lo mismo con las traducciones al euskara (Isasi, Balluerka y Gorostiaga, 2000).",Erreur
"Lanbide anitzeko taldeek, psikologo, pedagogo eta hezkuntza-profileko beste profesional batzuek osaturikoek, beren diagnostikoak eta jarduketako planak egiten dituzte, baina beren kategoriei eta irizpideei jarraituz, eta horiek ez datoz bat osasun-langileek erabiltzen dituztenekin.","Los equipos multiprofesionales, formados por psicólogos, pedagogos y otras figuras profesionales de perfil educativo, elaboran sus propios diagnósticos y planes de actuación, pero siguiendo sus propias categorías y criterios, no coincidentes con los utilizados por el personal sanitario.",Erreur
"Zerbitzuaz arduratzen den lantaldea psikologoek, hezitzaileek eta haur eta nerabeekin loturiko gaietako lanbide espezializatuetan aritzen diren profesionalek osatzen dute.","El equipo que atiende el servicio está formado por profesionales de la psicológía, de la educación social y otras profesiones especializadas en temas relacionados con infancia y adolescentes.",Erreur
Psikologoa Psikologia titulua lortu zuen Euskal Herriko Unibertsitatean 2001an.,Licenciada en Psicología por la Universidad del País Vasco UPV/EHU en el año 2001.,Erreur
"Modu berean, eta beraien lanez bakarrik arduratu daitezen, uhartean bertan lanean ari diren hainbat boluntarioei (sorosle, mediku, psikologo, …) ere jaten ematen diete.","También dan de comer a los voluntarios (socorristas, médicos, psicólogos, etc.) que operan en la isla, para que se puedan dedicar en exclusiva a salvar vidas.",Erreur
"Horren eraginez, psikologo askori betetzen zaie agenda Eguberriak igaro ondoren.",Son muchos los psicólogos que después de las navidades tienen la agenda llena.,Erreur
"Baliagarri izango zaizu hezitzailea, maisua, pedagogoa edo haur psikologoa bazara.","Te sirve si eres educador, maestro, pedagogo o psicólogo infantil.",Erreur
"Handiagotzen ari den generoaren ospeari ezker, gero eta psikologo, soziologo eta antropologo gehiago joko horien jokalarien ekintzak eta elkarrekintza aztertzen ari dira.","Con la creciente popularidad del género, un cada vez mayor número de psicólogos, sociólogos y antropólogos estudian las acciones e interacciones de los jugadores de tales juegos.",Erreur
"Nuestro Centro HAZKUNDEtik udaleku urbanoak diseinatu ditugu 3 eta 8 urte bitarteko umeentzat, jarduera dibertigarri eta dinamikoz betetako udalekuak dira, psikologo adituen gidaritzapean, haurrekin esperientzia zabala dutenak.","[:es]Como cada vez nos acercamos más a las navidades, desde HAZKUNDE hemos organizado unos campamentos urbanos de Navidad dirigidos a niños de entre 3 y 8, lleno de actividades divertidas y dinámicas para trabajar la inteligencia emocional.",Erreur
"Gure lan taldea psikologoz, logopedaz eta hezkuntza berezietan espezialistaz osaturik egoteak lan koordinatua egitea ahalbidetzen digu, baita kasu bakoitzak eskatzen duen eremu desberdinetatik ekiteak ere.","Nuestro equipo multidisciplinar formado por psicólogos, logopedas y especialistas en educación especial nos permite un trabajo coordinado, así como la posibilidad de abordaje de cada caso desde los diferentes ámbitos que requiera.",Erreur
"Maite Garaigordobil, psikologoa eta jolasaren ikertzailea (123 Kb)","Maite Garaigordobil, psicóloga e investigadora del juego (122 Kb)",Erreur
"- Estres postraumatikoaren konpultsiboaren inguruko hitzaldia, Rosa Lafuente psikologoaren eskutik",- Charla de Pablo Mondragón sobre el estrés postraumáticoç - Charla de Rosa Lafuente sobre el trastorno obsesivo-compulsivo,Erreur
"• Espezialista familiako eta bikoteen arteko terapian, Gaztela eta Leongo Psikologoen Elkargo Ofizialaren eskutik, 1983-1985.","- Especialista en Terapia de familia y de pareja por el Colegio Oficial de Psicólogos de Castilla-León, 1983-1985.",Erreur
Urtero 1.200 psikologoen bisita baino gehiago egiten dira Klinika Onlinearen bidez.,Se realizan más de 1.200 visitas de psicólogo a través de la Clínica Online al año.,Erreur
"osasun laguntza irunen eta hondarribian, anbulatorioa, klinikak, ospitaleak, gizarte ongizatea, gizarte-langilea, osasuna, osasun pribatua, medikuak, erizainak, gizarte eta osasuna, psikologoak, osasun mentala, adineko pertsonentzako gimnasia, osasuna irunen, osasuna hondarribian, osasun zentroa, osasun mentaleko zentroa, gizarte ongizatea irunen, gizarte zerbitzuak irunen, gizarte-langilea irunen","asistencia sanitaria en irun y hondarribia, ambulatorio, clínicas, hospitales, bienestar social, trabajador social, sanidad, sanidad privada, medicos, enfermeras, sociosanitario, psicologos, salud mental, gerontogimnasia, sanidad irun, sanidad hondarribia, centro de demencia senil, administrar medicamentos, administrar alimentos, primeros auxilios, enfermería, medico, enfermera, enfermero, psicologa, fisioterapeuta, quiromasajista, acompañar a mayores, acompañar a dependientes",Erreur
"osasun laguntza irunen eta hondarribian, anbulatorioa, klinikak, ospitaleak, gizarte ongizatea, gizarte-langilea, osasuna, osasun pribatua, medikuak, erizainak, gizarte eta osasuna, psikologoak, osasun mentala, adineko pertsonentzako gimnasia, osasuna irunen, osasuna hondarribian, osasun zentroa, osasun mentaleko zentroa, gizarte ongizatea irunen, gizarte zerbitzuak irunen, gizarte-langilea irunen","asistencia sanitaria en irun y hondarribia, ambulatorio, clínicas, hospitales, bienestar social, trabajador social, sanidad, sanidad privada, medicos, enfermeras, sociosanitario, psicologos, salud mental, gerontogimnasia, sanidad irun, sanidad hondarribia, centro de salud, centro mental, bienestar social irun, servicios sociales irun, trabajadora social psicologa, fisioterapeuta, quiromasajista, acompañar a mayores, acompañar a dependientes",Erreur
1 - Osasun esparruko psikologo lanetan aritzeko:,1 - Ejercer como psicólogos en el ámbito sanitario:,Erreur
Epaitegi psikologoak epaiketa batean ebaluazio psikologikoa eskatzen denean edo Justizia administrazioaren menpeko zerbitzuek horrela eskatutakoan hartzen du parte.,Psicología judicial El Psicólogo Jurídico actúa en caso de requerirse la evaluación psicológica en un proceso judicial o la intervención en los Servicios dependientes de Justicia.,Erreur
"Bostgarren blokea: “Gazteen irudia. Zer igortzen dugu eta nola eragiten du haiengan” Mahai-inguruan komunikazioan aditu gazte batek lagunduta, kazetari gazte batek, gizarte sareetako influencer batek eta psikologo batek aztertuko dituzte igortzen ditugun mezuak, estereotipoak, etab., gizartean geratzen den ideia kolektiboa osatzen dutenak.","Mesa redonda donde un periodista joven, una joven especializada en influencers y redes sociales y un psicólogo, moderadas por otra persona joven experta en comunicación, analizarán los mensajes, estereotipos… que emitimos y van configurando el ideario colectivo que se queda en la sociedad y las repercusiones que ello tiene en las personas jóvenes, en su propio autoconcepto… Terminaremos con un debate con las personas asistentes.",Erreur
"Osasun arloko profesionalak (emaginak, erizainak, medikuak, psikologoak eta psikoterapeutak, fisioterapeutak, okupazio-terapeutak, e.a.)","Profesionales de la salud (matronas, enfermeras, médicos, psicólogos y psicoterapeutas, fisioterapeutas, terapeutas ocupacionales, etc) Educadores y maestras",Erreur
"“Halaber, errehabilitazioko mediku espezialista, psikiatra, fisioterapeutak, psikologoak, terapia okupazionala, aisialdiko begiraleak, gizarte langileak, ile-apaindegia eta podologia zerbitzua ditugu”.","“Asimismo, contamos con médico especialista en rehabilitación, en psiquiatría, personal de fisioterapia, psicología, terapia ocupacional, monitor de tiempo libre, trabajo social peluquería y podología”.",Erreur
"Psikologoak bere parte hartzea bukatutzat eman beharko du eta ezin izango du ez isilean ezta azpikeriaz ere luzatu, aldez aurretik jarritako helburuak lorturik zein bere esku dituen bide eta errekurtsoak erabiliz eta bidezko denboraldia igarota hauek lortzeko gai ez dela ematen badu.","El/la Psicólogo/a debe dar por terminada su intervención y no prolongarla con ocultación o engaño tanto si se han alcanzado los objetivos propuestos, como si tras un tiempo razonable aparece que, con los medios o recursos a su disposición, es incapaz de alcanzarlos.",Erreur
"Filologoen, soziologoen, psikologoen, pedagogoen, antropologoen... artera iristea da gure erronketako bat.","Así, uno de nuestros principales desafíos en este sentido es llegar hasta filólogos, sociólogos, psicólogos, pedagogos, antropólogos...",Erreur
"Lau lantalde zehatzi begira hasi da azterlan hori: Fisioterapeutak, Psikologoak, Podologoak eta Hortz-higienistak.","Este análisis se ha iniciado en cuatro colectivos concretos: Fisioterapeutas, Psicólogos, Podólogos e Higienistas dentales.",Erreur
"Ez dute dirurik psikologotan xahutzeko, ez lanik, ez denborarik, ez indarrik, ez tresnarik urteen buruan eta seme-alaba izatean pilatu zaizkien saltsak konpontzeko.","No tienen dinero para psicólogos, ni trabajo, ni tiempo, ni energía, ni herramientas para arreglar los líos que han acumulado con los años y los hijos.",Erreur
"Sistema sozialean dugun barne-mailako esku-hartzearekin du zerikusia horrek, eta psikologoak, soziologoak, medikuak, maisu-maistrak, osasun-laguntzaileak eta dira gure esku-hartzeen esparrua osatzen dutenak.","Esto atañe a lo que se refiere a nuestra intervención interna en el sistema social: psicólogos, sociólogos, médicos, maestros, ATS, auxiliares, etc. etc. configura los marcos de nuestra intervención.",Erreur
"Gure egoitzetan, diziplina anitzeko taldeek elkarrekin lan egiten dute. Honako hauek dira talde horien kideak: medikuak, psikologoak, erizainak, gizarte-langileak, monitoreak eta erietxeko laguntzaileak.","En nuestras Residencias para la tercera edad trabajan de manera conjunta equipos multidisciplinares compuestos por médicos, psicólogos, enfermeras, trabajadoras sociales, monitoras y auxiliares de clínica.",Erreur
"Fernando Chacon Fuertes, Psikologoen Madrilgo Elkargo Ofizialeko dekanoa","Fernando Chacón Fuertes, Decano del Colegio Oficial de Psicólogos de Madrid",Erreur
"Psikologo eta psikiatra talde bat dugu, berezko Telemedikuntza Sistema baten bidez, Klinika Onlinak, langileak gure edozein laguntza zentrotan bisita egitea ahalbidetzen diguna.","Contamos con un equipo propio de psicólogos y psiquiatras, que a través de un Sistema de Telemedicina propio, la Clínica Online, nos permite visitar a trabajadores en cualquiera de nuestros centros asistenciales.",Erreur
Ameriketako Estatu Batuetako psikologoak,Etólogos de Estados Unidos,Erreur
"Beraren aurrean maitalea, ama, psikologoa, emaztegai-ohia eta koinata agertuko dira.","Ante él aparece su amante, su madre, su psicóloga, su ex-novia y su cuñada.",Erreur
"Beno, hori da niri iruditzen zaidana, zeren ni ez naiz ez soziologoa, ez psikologoa, ez historialaria...","Todo esto son apreciaciones mías. Yo no soy ni sociólogo, ni psicólogo, ni historiador...",Erreur
"Gipuzkoako Psikologoen Elkargo Ofizialarekin lankidetza-hitzarmen bat 2008az izateak, zeinak tarifak homologatu eta finkatzeko baldintzak ezartzen dituen, ez du esan nahi lizitazio, publikotasun eta prozeduren gardentasun, ez bereizkeria eta tratu-berdintasun printzipioak betetzen direnik.","La existencia de un convenio de colaboración con el Colegio Oficial de Psicólogos de Gipuzkoa (desde 2008) que establece condiciones de homologación y fijación de tarifas, no supone el cumplimiento de los principios de libertad de acceso a las licitaciones, publicidad y transparencia de los procedimientos, no discriminación e igualdad de trato.",Erreur
"Psikologoak eta gizarte-hezitzaileak gara, haurren eta nerabeen esparruan espezializatuak.",Somos psicólogos/as y educadoras/es sociales especializados en menores de edad y adolescentes.,Erreur
"Paul Watzlawick psikologoak El arte de amargarse la vida (""Bizitza samintzeko artea"") (Herder, 1989, Bartzelona) liburuan, egoera jakin batzuen aurrean geure estilo pertsonala identifikatzen laguntzen gaituelarik, bizitza zorigaiztokoa pixkanaka osatzeko pertsonak darabiltzan prozeduren gogoeta egin dezagun parada ezin ederragoa ematen digu.","Paul Watzlawick, en su libro ""El arte de amargarse la vida"" (Herder, 1989, Barcelona), nos ayuda a reconocer nuestro estilo personal frente a determinadas situaciones y nos brinda una excelente oportunidad para reflexionar sobre los procedimientos por los que una persona va construyéndose una vida desdichada.",Erreur
AECC_Gipuzkoako prebentzioa eta osasunaren hezkuntza arloko Psikologoa den Maider Sierraren hitzak. Barka eragozpenak.,"Palabras de Maider Sierra, Psicóloga para el Área de prevención y educación para la salud de Aecc_Gipuzkoa.",Erreur
"Programa Bizkaia Talentek zuzentzen du, ondoko hauekin koordinatuta: batetik, Bilbao Metropoli 30, EHUko Zientzia eta Teknologia Fakultatea, Deustuko eta EHUko Unibertsitateetako Zuzenbide Fakultateak, Deustuko Unibertsitateko Deusto Business School, EHUko Ingeniaritza Goi Eskola Teknikoa, Deustuko Ingeniaritza Goi Eskola (ESIDE), Mondragon Unibertsitateko Goi Eskola Politeknikoa, EHUko Ekonomia eta Enpresa Fakultatea; bestetik, bederatzi elkargo profesional: Ekonomistena, Euskal Herriko Kimikari eta Ingeniariena, Euskal Herriko Bide, Kanal eta Portuetako Ingeniariena, Abokatuena, Industria Ingeniariena, Geologoena eta Euskal Herriko Psikologoena.","El programa está liderado por Bizkaia Talent y coordinado junto con Bilbao Metropoli-30 además de la Facultad de Ciencia y Tecnología de la UPV/EHU, Facultad de Derecho de Deusto y de la UPV/EHU, Deusto Facultad de Economía y empresa de la UPV/EHU y nueve colegios profesionales: el de Economistas; Químicos e Ingenieros Químicos del País Vasco; Ingenieros de Caminos, Canales y Puertos del País Vasco, Abogados, Ingenieros Industriales, Geólogos y Psicólogos de Euskadi.",Erreur
"Jakinarazten dizugu formulario honen bidez eskuratutako datu pertsonalak eta helbide elektronikoa BIZKAIKO PSIKOLOGOEN ELKARGO OFIZIALAren ardurapeko fitxategi batean gordeko ditugula, bai zure eskaerei erantzuteko, bai erakundearekin lotutako informazioa bidaltzeko.","Le informamos que los datos personales obtenidos mediante este formulario, así como su dirección de correo electrónico, han sido incorporados en un fichero PSICOLOGÍA DE BIZKAIA se compromete a usar los datos recogidos mediante este formulario, únicamente para la finalidad anteriormente mencionada.",Erreur
"Psikologoaren konponbide magikotik urrun, bizitza baldintzak zaintzea beharrezkoa da, gizarte bezala, gure burua eta gure ongizatea zaintzeko.","Por eso, lejos de la varita mágica del psicólogo, resulta necesario atender globalmente a las condiciones generales de vida para cuidar también nuestra mente y nuestro bienestar.",Erreur
"Atal honetan batetik Giza baliabideak bereiztuko ditugu, eta bestetik Baliabide materialeak: Giza baliabideen artean hauek daude: Psikologoa, Bigarren Hezkuntzako orientatzailea, tutoreak, irakasleak, familia, fisioterapeuta, logopeda eta laguntza irakaslea.","En este punto diferenciaremos los recursos humanos de los materiales: Entre los recursos humanos se encuentran: la psicóloga, el orientador de secundaria, los tutores, los profesores, la familia, la fisioterapeuta, el logopeda y el profesor de apoyo, en su caso.",Erreur
"Asteazkenean, apirilaren 25ean, hurrengo bilkura honetan, MINORETAKO SEXUAL ABUSEAK aztertuko ditugu, Rocío Carmona Horta, psikologoa eta gaiari buruzko adituen arabera.","En nuestra próxima tertulia el miércoles día 25 de Abril debatiremos sobre LOS ABUSOS SEXUALES A MENORES, según el mejor criterio de Rocío Carmona Horta, Psicóloga y conocedora del tema.",Erreur
Bilboko Aita Menni Neuroerrehabilitazio Zentroko neuropsikologo eta koordonatzailea den Noemí Álvarezek lan nabarmena egin zuen Espainiako Neuropsikologia Elkarteen Federaizoak (FANPSE) martxoaren 1etik 3ra Valentzian antolatutako Neuropsikologiako X. Kongresu Nazionalean.,"La neuropsicóloga Noemí Álvarez tuvo una labor destacada en el X Congreso Nacional de Neuropsicología, organizado por la Federación de Asociaciones de Neuropsicología de España (FANPSE) del 1 al 3 de marzo en Valencia.",Erreur
"Pertsona bat berarekin egiten diren esku-hartzeetan oso konplexua da osasun arloko (psikiatra aholkularia, sendagileak, laguntzaileak...) eta espetxeetako (psikologoa, jurista, hezitzaileak, gizarte langilea, barne funtzionarioa...) profesionalen esku-hartzea koordinatzea, pertsona horrekin banaka erlazionatzen baitira eta egoeraren ikuspegi atomizatua izaten baitute zenbaitetan.","Se subraya la complejidad de coordinar la intervención sobre una misma persona de profesionales del ámbito sanitario (psiquiatra consultor/a, médicos/as, auxiliares…) y del ámbito penitenciario (psicóloga/o, jurista, educadores/as, trabajador/a social, funcionarios/as de interior…) que se relacionan con la persona individualmente y a veces tienen una visión atomizada de su situación.",Erreur
"Urte horretan, gero Skinner-ek “garai iluna” deituko zuena, Bertrand Russellen “An Outline of Philosophy” irakurri zuen. Liburu honetan Russellek psikologoen filosofia konduktista eztabaidatzen zuen bereziki John B. Watsonena.","Durante este periodo, al cual más tarde llamó ""el año oscuro"", leyó An Outline of Philosophy, de Bertrand Russell, en el cual Russell discutía la filosofía conductista de los psicólogos, especialmente de John B. Watson.[7]",Erreur
Mentxu psikologoa eta kriminologoa da eta gaur egun sexologiari buruzko master bat ikasten ari da.,Mentxu es Psicóloga y Criminóloga y ahora se encuentra cursando un master en Sexología.,Erreur
