Basque (eu),Spanish (es),Spanish_Translation
"FSFk gainera programatzaileak kontratu zituen GNU proiektuan lan egiteko, baina garapenaren zati handi bat (eta honela jarraitzen du izaten) bolondresek egin zuten.","La FSF también contrató programadores para contribuir a GNU, aunque una porción sustancial del desarrollo fue (y continúa siendo) producida por voluntarios.","La FSF había contratado además a los programadores para trabajar en el proyecto GNU, pero buena parte del desarrollo (y sigue siendo así) lo hicieron voluntarios."
"Musikari eta programatzaileak, aukera baten bila","Músicos y programadores, en busca de oportunidades","Músicos y programadores, buscando una opción"
Programatzailea bazara eta erronkak gustatzen bazaizkizu...,Si eres programador/a y te gustan los retos…,Si eres programador y te gustan los retos...
"Irabazleak 36 urteko Josetxo Pérez Fernández, sistema-administratzailea eta Pedro Domecq Aguirre, 45 urtetako programatzailea, hiru dimentsiotako espezialista eta sare-administratzailea.","El ganador ha sido un equipo formado por Josetxo Pérez Fernández, de 36 años, administrador de sistemas y Pedro Domecq Aguirre, 45 años, programador, especialista en datos 3D y administrador de redes.","Los ganadores fueron Josetxo Pérez Fernández de 36 años, administrador de sistemas y Pedro Domecq Aguirre, programador de 45 años, especialista en tres dimensiones y administrador de redes."
Fabrikazio mekanikoko sistema automatizatuen programatzailea.,Programadora o Programador de sistemas automatizados en fabricación mecánica.,Programador de sistemas automatizados de fabricación mecánica.
"Artistei laguntasuna emateko PICA egitasmo intentsiboan aukeratutako 16 pertsonak, Pyrenart proiektuko kide diren erakundeak –biak ere Bilboko Udala kide duten ekimenak–, nazioarteko programatzaileak eta artistak gaur arratsaldetik aurrera elkartuko dira, ikuskizunetan eta tailerretan eta lan saioetan.","Las 16 personas seleccionadas en el proyecto intensivo de acompañamiento de artistas PICA, las entidades socias del proyecto Pyrenart, –iniciativas en las que participa el Ayuntamiento de Bilbao–programadores internacionales y artistas se darán cita desde esta tarde, tanto en espectáculos como en talleres y sesiones de trabajo.","16 personas elegidas en el programa intensivo PICA, las entidades que forman parte del proyecto Pyrenart -las dos también del Ayuntamiento de Bilbao, programadoras internacionales y artistas se reunirán a partir de esta tarde en espectáculos y talleres y sesiones de trabajo."
"Ukraniako Aleksandr Balagura zinemagileak, Italiako Daniele Dottorini kritikariak eta programatzaileak, Frantziako Alain Fleischer zuzendariak, Ipar Amerikako Toby Lee artistak eta Argentinako Vivi Tellas dramagileak osatuko dute Punto de Vista Jaialdiaren hamaikagarren edizioaren Nazioarteko Epaimahaia.","Aleksandr Balagura, Daniele Dottorini, Alain Fleischer, Toby Lee y Vivi Tellas integrarán el Jurado Fleischer, la artista norteamericana Toby Lee y la dramaturga argentina Vivi Tellas serán los miembros del Jurado Internacional de esta undécima edición del Festival Punto de Vista.","El cineasta ucraniano Aleksandr Balagura, el crítico y programador Daniele Dottorin de Italia, el director francés Alain Fleischer, el artista norteamericano Toby Lee y el dramaturgo vasco Vivi Tellas, constituirán el Jurado Internacional de la undécima edición del Festival Punto de Vista."
Programatzailea konputagailuak uler dezakeen programazio lengoaia erabiliz prototipoak ezartzeaz arduratzen da.,"El programador se encarga de la implementación de prototipos mediante un lenguaje de programación, que compilados pueda entender la computadora.",El programador se encarga de establecer prototipos utilizando el lenguaje de programación que la computadora puede entender.
"Legoaiaren sortzaileak, Yukihiro ""Matz"" Matsumoto, programatzailea dibertitzeko eta bere produktibitatea zabaltzeko diseinatuta dagoela esan du, erabiltzaileentzat interface ona diseinuko printzipioa jarraituz[1] Gizakien beharrak makinenak baino gehiago kontuan hartu behar direla pentsatzen du:[2] «","El creador del lenguaje, Yukihiro ""Matz"" Matsumoto, ha dicho que Ruby está diseñado para la productividad y la diversión del desarrollador, siguiendo los principios de una buena interfaz de usuario.[1] Sostiene que el diseño de sistemas necesita enfatizar las necesidades humanas más que las de la máquina:[2]","El creador del legoa, Yukihiro ""Matz"" Matsumoto, ha señalado que el programador está diseñado para divertirse y difundir su productividad, siguiendo el principio de diseño de una buena interface para los usuarios[1] que las necesidades humanas deben tener más en cuenta que las de las máquinas:[2] }"
Programatzailearen zeregin bakarra analistaren argibideak ordenagailuak egikaritu ditzakeen kodeetan ezartzea da.,El programador cuya única función consistía en trasladar las especificaciones del analista en código ejecutable para la computadora.,La única función del programador es establecer las instrucciones del analista en los códigos que puede ejecutar el ordenador.
"Irratiko programatzailea eta zinema zalea izan zen; hamalau filmetan parte hartu zuen, paper garrantzitsuak ere bete izan zituelarik.","Fue programador de radio y gran aficionado al cine, actuó en catorce películas, llegando a interpretar papeles estelares.","Fue programador de radio y aficionado al cine; participó en catorce películas, desempeñando importantes papeles."
Antzerki programatzaileak Dantza tailerrak,Organizador de espectáculos de danza,Talleres de danza programadores de teatro
"Oinarrizko programazioko kontzeptuak, ikasketa modularrak, interaktibotasuna eta guztiz guztiz pertsonalizagarria den zentzu handiak, zer moduz aldatu beharko litzatekeen programatzailea?","Conceptos básicos de programación, aprendizaje modular, interactividad y una gran dosis de ternura que es casi completamente personalizable, ¿qué más necesitaría el programador en ciernes?","Los conceptos de programación básica, los estudios modulares, la interacción y los grandes sentidos totalmente personalizables, ¿cómo se debería cambiar el programador?"
"Jarduera “berezia” da, baina beste jarduera ugari multzokatzen dituena ere bai: “komisarioa” programatzailea, ekoizlea, kritikoa, irakaslea, idazlea… ere bada, edo Serge Daneyren hitzetan, passeurra.","Actividad “singular”, es también un compendio de muchas otras actividades: el “comisario” es a la vez programador, productor, crítico, docente, escritor… o en palabras de Serge Daney, passeur.","La actividad es especial. Pero también es una actividad que agrupa otras muchas actividades: el programador 1977comisario GNU, el productor, el crítico, el profesor, el escritor... o, según Serge Daney, el passeur."
"Tess Renaudo (Bartzelona) L’Alternativa, Bartzelonako Zinema Independente Jaialdia, zuzendaritza-taldeko kideetako bat da eta jaialdiko programatzailea da lehiaketako filmak koordinatzeaz gain.",Tess Renaudo (Barcelona) forma parte del equipo directivo de del festival además de coordinar los films a competición.,"El Festival de Cine Independiente de Barcelona Tess Renaudo (Barcelona), es uno de los miembros del equipo directivo y es programador del festival además de coordinar las películas del certamen."
"[Diru horrekin, kazetariari, programatzaileari eta bistaratzaileari ordainduko zaie] KUDEAKETA-PLANIK EZ.","[Con este dinero se pagará al periodista, al programador y al visualizador] SIN PLANES DE GESTION.","[Con este dinero, se abonarán al periodista, programador y visualista] POR PLANES DE GESTIÓN."
"Gaur bertan, programatzaileak eta sortzaileak elkarrekin hasiko dira lanean han.","Hoy mismo, programadores y creadores comenzarán a trabajar juntos allí.","Hoy mismo, los programadores y creadores comenzarán a trabajar juntos."
CNCko programatzailea.,Programadora o Programador de CNC.,Programador de CNC.
"Hasiera Albisteak Larraioz enpresa gipuzkoarrak Diasporako teknikari, ingeniari eta programatzaileak eskatzen ditu; CVak urriaren 31era arte","busca en la Diáspora técnicos/as, ingenieros/as y programadores/as; envío de CVs hasta el 31/10","Inicio Noticias La empresa guipuzcoana Larraioz solicita técnicos, ingenieros y programadores de la Diáspora, hasta el 31 de octubre"
Zure gailuaren overclockinga hackeatu duen programatzailea naiz.,Soy el programador que hackeó el 0C de su dispositivo.,Soy el programador que hackeó el overclocking de su dispositivo.
"Autonomoa, enpresaburua, abokatua, merkataria, freelancea, arkitektoa, programatzailea, aholkulari fiskala… zarena zarela ere, zeure kabuz lan egiten duzun emakumea bazara, anima zaitez!","Para quién: autónoma, empresaria, artista, abogada, comerciante, freelance, arquitecta, programadora, asesora fiscal, …seas quien seas, si trabajas por tu cuenta, ¡anímate!","Autonómico, empresario, abogado, comerciante, freelance, arquitecto, programador, asesor fiscal... ¡si eres una mujer que trabajas por tu cuenta, anímate!"
"FSFk gainera programatzaileak kontratu zituen GNU proiektuan lan egiteko, baina garapenaren zati handi bat (eta honela jarraitzen du izaten) boluntarioek egin zuten.","La FSF también contrató programadores para contribuir a GNU, aunque una porción sustancial del desarrollo fue (y continúa siendo) producida por voluntarios.","La FSF había contratado además a los programadores para trabajar en el proyecto GNU, pero buena parte del desarrollo (y sigue siendo así) lo hicieron voluntarios."
Erabili Hootsuite bezalako programatzaileak zure mezuak antolatzeko.,Usa programadores como Hootsuite para programar tus publicaciones.,Utiliza programas como Hootsuite para organizar tus mensajes.
"Batzorde hori Koldo Almandoz zinemagile eta kazetariak, Özge Calafato kazetari eta zinema-programatzaileak, Alexei Dmitriev zinemagileak eta Guillermo G. Peydró zinemagileak osatzen dute.","Este comité está integrado por el cineasta y periodista Koldo Almandoz, la periodista y programadora de cine Özge Calafato, el cineasta Alexei Dmitriev y el cineasta Guillermo G. Peydró.","Esta comisión está formada por el cineasta y periodista Koldo Almandoz, el periodista y programador de cine ugatzge Calafato, el cineasta Alexei Dmitriev y el cineasta Guillermo G. Peydró."
"Carlos Romero Nave 9 aretoaren arduraduna da. Musika-programatzailea da, eta ibilbide aitortua du Bilboko musikaren esparruan.","Carlos Romero, es el responsable de Nave 9, programador musical del Museo y que cuenta con una reconocida trayectoria en ámbito musical de Bilbao.","Carlos Romero Nave es responsable de la sala 9, programadora musical con un recorrido reconocido en el ámbito de la música de Bilbao."
"Horretarako, ilustratzaileak eta programatzaileak, idazleak eta irakurleak, jokalariak eta kontalariak jarriko dituzte harremanetan.","Para ello, contarán con la participación de ilustradores y programadores; escritores y lectores; jugadores...","Para ello, se pondrá en contacto a ilustradores y programadores, escritores y lectores, jugadores y narradores."
PLC Programazioa Berritek esperientziadun programatzaileak edo PLC PLC talde bat du.,Programación de PLC Berritek cuenta con un experimentado equipo de programadores de autómatas o PLCs.,La Programación PLC Berrit cuenta con un programador con experiencia o grupo PCC.
"Plataformak mahaigaineko aplikazioentzat komunak diren zerbitzuak eskaintzen ditu, programatzaileari bere aplikazioaren kodigo zehatzean lan egitea errazten, gainontzeko programazioa plataformak berak eskaintzen baitu.","La plataforma ofrece servicios reusables comunes para las aplicaciones de escritorio, permitiendo a los desarrolladores centrarse en la lógica de sus aplicaciones.","La plataforma ofrece servicios comunes a las aplicaciones del escritorio, facilitando al programador el trabajo en el código específico de su aplicación, ya que el resto de programación lo ofrece la propia plataforma."
"Ez dira bateraezinak, programatzailearen ikuspuntutik biak eman daitezke aldi berean.","Creo que no son incompatibles, que pueden coexistir desde el punto de vista del programador.","No son incompatibles, pueden darse ambas a la vez desde el punto de vista del programador."
Ekintza honek programatzaileak korporaziotik at lagatzen ditu.,"En efecto, esto deja a los programadores fuera de la compañía.",Esta acción deja fuera de la corporación a los programadores.
Bertsio eskuragarri daude sistema sustatzaile eta programatzaileak .,Las versiones están disponibles para los desarrolladores de sistemas y programadores .,Las versiones disponibles son los sistemas promotores y programadores.
"John Hall (Sarean, ""Maddog"" ezizenez ezaguna) ingeniari eta programatzailea software askearen eremuan pertsonaiarik nabarmenenetako bat izateaz gainera, horren hedakuntzan aktibista historikoa da.","John Hall, conocido en la Red por el apodo ""Maddog"", ingeniero y programador legendario, es una de las personalidades más relevantes en el ámbito del software libre y un histórico activista en su difusión.","El ingeniero y programador John Hall, conocido como ""Maddog"", además de uno de los personajes más destacados en el campo del software libre, es un activista histórico en su difusión."
"Iturburu-programa itzuli eta era iraunkorrean konpilazioan sortzen den objektu-kodea grabatu beharrean, programatzaileak soilik iturburu programa eta prozesatuko diren datuak soilik kargatzen ditu konputagailuan.","En lugar de traducir el programa fuente y grabar en forma permanente el código objeto que se produce durante la compilación para utilizarlo en una ejecución futura, el programador solo carga el programa fuente en la computadora junto con los datos que se van a procesar.","En lugar de traducir el programa fuente y grabar el código objeto que se produce en la compilación de forma sostenible, el programador sólo carga en su equipo el programa fuente y los datos que se procesarán."
"Kultura hartan, softwarearen programatzaileak eta garatzaileak beraien artean libreki programak elkartrukatzea arrunta zen.","En dicha cultura, era común que los programadores y desarrolladores de software compartieran libremente sus programas unos con otros.","En aquella cultura, el intercambio de programas libremente entre los programadores y desarrolladores del software era común."
"Profesioak urteak eta urteak daramatza lanean (sortzaileak eta konpainiak aipatzeaz gain, kudeatzaileak eta programatzaileak ere aipatu nahi ditut), jendearekin konprometituta, gogotik lanean kreazioak eta programazioak aurrera ateratzeko ahaleginetan eta, egia da, hogeita hamar urte pasa eta gero agertoki ugari ditugu eta maila artistiko ona lortu dugu, baina, hori, gaur, ez da nahikoa.","La profesión (y me refiero no solo a creadores o compañías sino también a gestores y programadores) lleva años comprometida en su trabajo, comprometida con el público, dejándose la piel en sus creaciones y programaciones y, es verdad, después de treinta años contamos con un importante número de escenarios y hemos alcanzado un buen nivel artístico pero, esto, hoy, no es suficiente.","La profecía lleva trabajando años y años (no sólo hace mención de creadores y compañías, sino también de gestores y programadores), comprometidos con la gente, tratando de sacar adelante las creaciones y programaciones, y es cierto que después de treinta años tenemos muchos escenarios y hemos alcanzado un buen nivel artístico, pero eso hoy no es suficiente."
"1972: Karen Spärck Jones (1935etik 2007 arte), informazioaren berreskuratzean eta lengoaia naturalaren prozesamenduan aitzindaria. 1979: Carol Shaw (?), Joko-diseinatzailea eta programatzailea Atari Corp. eta Activision enpresetan.","1972: Karen Spärck Jones, pionera de recuperación de información y procesamiento del convirtiéndose de ese modo en la primera mujer diseñadora de videojuegos por sus trabajos Polo, que finalmente no llegó a publicarse, quedándose en mero prototipo.[18]","1972: Karen Spärck Jones (desde 1935 hasta 2007), pionera en la recuperación de la información y procesamiento del lenguaje natural. 1979: Carol Shaw (?), diseñador y programador de juegos en las empresas Portal Corp. y Activision."
Analista eta programatzaileen arteko komunikazio arazoa dela eta (dokumentu bat ez da nahikoa zer egin nahi den azaltzeko) beste lan kategoria bat sortu zen analista-programatzailea deiturikoa.,"De manera que la lo que se quiere hacer) dio origen a una categoría de profesional intermedia, denominada analista-programador.",Debido al problema de comunicación entre analistas y programadores (un documento no es suficiente para explicar lo que se quiere hacer) surgió otra categoría de trabajo llamada analista programadora.
"Mar de Platako (Argentina) zinemaldiko programatzailea denez, bere esperientziaz arituko da eta 90. hamarkada amaieratik gaur arte zinema argentinarraren ibilbidea erakusteko film zatiak proiektatuko ditu.","Como es programadora del festival de Mar de Plata, hablará de su experiencia allí y mostrará fragmentos que muestren la trayectoria del cine argentino desde finales de los noventa hasta la actualidad.","Como programador del Festival de Cine de Mar de Plata (Argentina), ofrecerá desde finales de la década de los 90 fragmentos de películas para mostrar la trayectoria del cine argentino."
"Fedea dugu lankidetzan eta hainbat eremutako profesionalekin partekatzen dugu gure lana (argazkilariak, programatzaileak, arkitektoak, ilustratzaileak, idazleak...), proiektuak eskatzen duenean.","Creemos en la colaboración y compartimos nuestro trabajo con profesionales de diversos ámbitos (fotógrafos, programadores, arquitectos, ilustradores, escritores…), cuando el proyecto lo requiere.","Tenemos fe en la colaboración y compartimos nuestro trabajo con profesionales de diferentes ámbitos (fotografías, programadores, arquitectos, ilustradores, escritores...) cuando el proyecto lo requiere."
"Oro har, erabat burututako lanak izaten dira, orotariko sektoreetan: programatzaileak, web-orrien diseinatzaileak eta baita edukien idazlariak ere izaten dira.","Por lo general, se trata de encargos “llave en mano” en sectores muy diferentes: desde programadores hasta diseñadores de páginas web o redactores de contenidos.","En general, son trabajos totalmente realizados en todos los sectores: programadores, diseñadores de páginas web, así como escribas de contenidos."
"Iparraldeko euskal dantza munduko eragileen errepertorioa kategoriatan sailkatuak (taldeak, koregrafoak, programatzaileak, formatzaileak, baliabide zentroak...).","Todo un repertorio de actores de la danza vasca en el País Vasco norte (coreógrafos y compañías, programadores, centros de recursos...).","El repertorio de los actores del mundo de la danza vasca en Iparralde se clasifica en categorías (grupos, coreógrafos, programadores, formadores, centros de recursos...)."
"Azokarako akreditazioa nahi duten profesionalentzat da izen-ematea (programatzaileak, konpainiak, banatzaileak, prentsa, erakundeak...).","Esta inscripción es para aquellos/as profesionales (programadores, compañías, distribuidores, prensa, instituciones…) que quieran acreditarse en la Feria.","La inscripción es para los profesionales que deseen acreditación para la feria (programadores, compañías, distribuidores, prensa, instituciones...)."
"Gigalight ECOC 2016n Cloud Programatzailea erakutsi du Shenzhen, Txina, iraila 28, 2016 - ECOC 2016 urteko ekitaldia C Convention C ospatu zen...","Shenzhen, China, septiembre 28, 2016 - El gran evento anual ECOC 2016 se realizó en la Convención C...","Gigalight ECOC 2016 muestra al Programador Cloud en Shenzhen, China, 28 septiembre, 2016 - ECOC 2016, un evento anual celebrado en C Convention C..."
"Gigalight Interkonexio optikoko diseinu optiko orokorra da, diseinatu, fabrikatu eta hornitzen dituena Transkriptore optikoak, osagai pasiboak, kable optiko aktiboak, MTP / MPO kableak, laino programatzaileak eta zuzentzaileak, eta modulu optiko koherenteak eta abar, hiru aplikazio nagusi: Data Center eta Cloud Computing, Metro & Broadcast Network, eta Wireless & 5G Optical Network.","Quienes Somos Gigalight Gigalight es un innovador de diseño de interconexión óptica global que diseña, fabrica y suministra transceptores ópticos, componentes pasivos, cables ópticos activos, Cableado MTP / MPO, programadores y verificadores en la nube y módulos aprovecha las ventajas del diseño exclusivo para proporcionar a los clientes dispositivos de red óptica de ventanilla única y productos rentables.","Gigalight es un diseño óptico general de interconexión óptica que diseña, fabrica y proporciona transcriptores ópticos, pasivos, cables ópticos activos, MTP / MPO cables, nieblas programadoras y correctoras, y módulos ópticos coherentes, etc., tres aplicaciones principales: Data Center y Cloud Computing, Metro & Broadcast Network, y Wireless & 5G Optical Network."
"Dakigunez, Moodle eten gabe garatzen ari den elkarlana da eta hainbat programatzaileak ezartzen dizkiete ondoren Moodle-ren bertsio berriak osatuko dituzten modulu berriak.",Como sabemos Moodle es un proyecto colaborativo en constante desarrollo al que diferentes programadores incluyen módulos nuevos que con el tiempo generan nuevas versiones de Moodle.,"Como sabemos, Moodle es una colaboración que se está desarrollando ininterrumpidamente y que les impone varios programadores, tras lo cual, los nuevos módulos que van a configurar las nuevas versiones de Moodle."
"Gigalight Bezeroentzako software liburuaren bertsio publikoetako bertsioa eskaintzen du dohainik, hodei-programatzailea erosten duzunean, doan eskuratu dezakezu bateragarritasun-kode publiko guztiak Gigalight Hodeiko zerbitzaria, eta kodeak datu-basean eguneratu egingo dira.","Gigalight proporciona la versión de códigos de compatibilidad pública del software cliente de forma gratuita; una vez que compra el programador en la nube, puede obtener de forma gratuita todos los códigos de compatibilidad públicos almacenados en Gigalight Servidor en la nube, y los códigos se mantendrán actualizados en la base de datos.","Gigalight ofrece gratuitamente la versión de las versiones públicas del software para clientes, cuando compre el programador de nubes, puede obtener gratuitamente todos los códigos públicos de compatibilidad como servidor de Nube Gigalight y los códigos se actualizarán en la base de datos."
"2019ren udaberriaren hasieran eta 5G-en, Wuhan-en hegoalderantz Gigalight Teknologia Zentroa, Shenzhen Teknologia Zentroa eta konpainiaren marketin zentroak gurekin bat egiteaz gain, hurrengo bost urteko komunikazio optikoko negozioen aurrerapen handia diseinatu, fabrikatu eta hornitzen dituena Transkriptore optikoak, osagai pasiboak, kable optiko aktiboak, MTP / MPO kableak, laino programatzaileak eta zuzentzaileak, eta modulu optiko koherenteak eta abar, hiru aplikazio nagusi: Data Center eta Cloud Computing, Metro & Broadcast Network, eta Wireless & 5G Optical Network.","Al comienzo de la primavera de 2019 y el auge de 5G, Wuhan Gigalight El Centro de Tecnología, el Centro de Tecnología de Shenzhen y el centro de mercadeo de la compañía esperan que usted se una a nosotros y logre el gran avance de los próximos cinco años en el negocio de la comunicación óptica en el Gigalight. Quienes Somos Gigalight Gigalight es un innovador de diseño de interconexión óptica global que diseña, fabrica y suministra transceptores ópticos, componentes sCompetitividad del núcleoTrabajosContáctenos Comunidad","Además de compartir con nosotros el Centro Tecnológico Gigalight de Wuhan, el Centro Tecnológico Shenzhen y los centros de marketing de la compañía, en el inicio de la primavera de 2019 y en el sur de Wuhan, diseñan, fabrican y abastecen el gran progreso de los negocios de comunicación óptica durante los próximos cinco años, fabrican transcriptores ópticos, elementos pasivos, cables ópticos activos, MTP/ MPO, nieblas programadoras y correctoras, y módulos ópticos coherentes, etc., tres principales aplicaciones: Fecha Center y Cloud Com"
"Gure proiektuetan, diseinu-prozesuak irekitzen saiatzen gara, rol eta dikotomia tradizionalak (diseinatzailea – erabiltzailea – programatzailea – publikoa, administrazioa – herritarra, hezitzailea – ikaslea) hackeatuz, bottom up logikatik (edo behetik gorako logika) abiatuta.","En nuestros proyectos tratamos de abrir los procesos de diseño hackeando los roles y dicotomías tradicionales (diseñador/a – usuario/a, programador/a – público, administración – ciudadanía, educador/a – alumno/a) desde una lógica bottom-up o de abajo hacia arriba.","En nuestros proyectos tratamos de abrir los procesos de diseño, partiendo de la lógica bottom up (o lógica superior)."
"Zure landareak ureztatzeko beharrezko osagarri guztiak, mahuka edo garaztailuak, lorategirako ureztatze sistemak, programatzaileak, oporretarako ureztatze sistemak, ihiztailuak, lainoztagailuak, eta askoz gehiago.","Una completa sección dedicada al riego donde encontrarás desde regaderas o mangueras, hasta el jardín, programadores, riego para vacaciones, riego por goteo, accesorios para riego, aspersores, pulverizadores y mucho más.","Todos los accesorios necesarios para el riego de tus plantas, mangas o cebadas, sistemas de riego para el jardín, programadores, sistemas de riego para vacaciones, juncales, nieblas, y mucho más."
CNCko programatzailea.,Programador de CNC.,Programador de CNC.
"Ling Tan diseinatzailea, sortzailea eta programatzailea da.","Ling Tan es diseñadora, creadora y programadora.","Ling Tan es diseñador, creador y programador."
