Basque (eu),Spanish (es),Spanish_Translation
Dock Of The Bay jaialdian ikusi ahal izan genuen Mursego ardatz duen “Invisible” film sailkaezinaren zuzendari da Victor Iriarte. Baita Tabakalerako programatzailea ere.,"Víctor Iriarte es el director de ""Invisible"", película inclasificable alrededor de la figura de Mursego, que pasó por el festival También es el programador de Tabakalera.","Víctor Iriarte es el director de la incompetente película de Mursego, con el eje de Dock Of The Bay, y el programador de Tabakalera."
"""Bideojoko programatzaileak"" kategoriako artikuluak",Páginas en la categoría «Programas de televisión sobre videojuegos»,"Artículos de la categoría ""Programadores de vídeo"""
Produkzioaren programatzailea.,Programadora o Programador de la producción.,Programador de producción.
"Alderdi teknikoan, informatikari eta programatzaileak dira izar nagusiak: tresna zein hizkuntza ugariz baliatuz (php, html eta Javascript, besteak beste), nabigazioa eta elkarreraginkortasuna errazteko baliabideak integratzen dituzte, merkataritzako transakzioak “atsegin” eta ziurragoak izan daitezen.","En la parte técnica, las grandes estrellas son informáticos y programadores, encargados de construir e integrar, a través de los diferentes lenguajes (php, html, Javascript, entre otros) y herramientas, recursos que faciliten la navegación, la interactividad y la hagan más “amigable” y segura, en términos de transacciones comerciales.","En el aspecto técnico, las principales estrellas son las informáticas y programadoras: a través de múltiples herramientas y lenguas (php, html y Javascript, entre otras), integran recursos para facilitar la navegación y la interacción, con el fin de que las transacciones comerciales sean más favorables y seguras."
Aplikazioen programatzailea (28),Programador de aplicaciones (28),Programador de aplicaciones (28)
Historiako lehenengo programatzailea izan zen… emakumezkoa!,Por esti El primer programador de la historia fue… ¡una programadora!,Fue el primer programador de la historia... ¡mujer!
"Kategoria:Bideojoko programatzaileak - Wikipedia, entziklopedia askea. Laguntza","Categoría:Programas de televisión sobre videojuegos - Wikipedia, la enciclopedia libre","Categoría: Programadores de videojuegos - Wikipedia, enciclopedia libre. Ayuda"
"1960 eta 1970eko hamarkadan softwarea ez zen produktu bat kontsideratzen, garai hartako konputagailu handien saltzaileek (mainframes izenekoak) beren erosleei ematen zien eranskin bat bezala baizik, ondoren hauek erabili ahal izateko.[2] Kultura hartan, softwarearen programatzaileak eta garatzaileak beraien artean libreki programak elkartrukatzea arrunta zen.","Índice HistoriaEditar Artículos los años 1960 y 1970, el software no se consideraba un producto sino un añadido que los vendedores de las grandes computadoras de la época (las mainframes)[7] aportaban a sus clientes para que estos pudieran usarlas.","En la década de 1960 y 1970 el software no se consideraba un producto, sino como un aditamento que los vendedores de grandes computadoras de la época, llamados maimframes, daban a sus compradores para poder utilizarlos posteriormente.[2] En aquella cultura, el programador y desarrollador del software era común entre ellos el intercambio de programas."
Sistema diseinatzailea eta programatzailea,Diseñador y Programador Sistema,Sistema diseñador y programador
"Eta ez dadila aipatu gabe geratu, zuentzat, sorgin-artistontzat, aukera moduan ere proposatzen dugula arte-bilera hau, sortzeko prozesuan dauden lanen zatiak aurkeztu eta dokumentatu ahal izateko eta, aldi berean, programatzaileak/komisarioak gonbidatzeko, etorkizun hurbilean eskuragarri egongo diren piezak eta lanak proposatzeko haiei.","Y que no quede sin mencionar que lo proponemos también como una oportunidad para vosotrxs, sorgins-artistas, podás presentar y documentar fragmentos de trabajos en proceso de creación, y a su vez, invitar a programadorxs/comisarixs para proponerles piezas y trabajos que estarán disponibles en un futuro próximo.","Y que no quede sin mencionar que para vosotros, como brujas-artestas, proponemos también esta reunión de arte como oportunidad para presentar y documentar fragmentos de las obras en proceso de creación y, al mismo tiempo, invitar a los programadores/comisarios a proponer piezas y trabajos disponibles en el futuro próximo."
"Atal ofizialeko saridunak aukeratuko dituzte Ben Russell eta Naomi Uman zinemagileek (lehenbizikoak film onenaren Punto de Vista saria irabazi zuen 2010eko otsailean), MoMAko Josh Siegel programatzaileak eta Josep M. Català akademikoak. 2010.10.08","Los cineastas Ben Russell (ganador del premio Punto de Vista a la mejor película en febrero de 2010) y Naomi Uman serán de momento los encargados, junto con el programador del MoMA Josh Siegel y el académico Josep Mª Catalá, de decidir qué películas de Sección Oficial serán galardonadas.","Los cineastas Ben Russell y Naomi Uman (el primero ganó el Punto de Vista a la mejor película en febrero de 2010), el programador Josh Siegel de MoMA y el académico Josep M. Català.08."
